country,contents
대만,"두근 두근 대만여행 ~~^^ (1):wife와 함께한  대만 여행 행복  사랑  힐링 여행으로 아름다운 추억  만들고  장성 가이드님 친절하고  관광지하나하나  설명  정말  감사합니다....
 "
대만,"3박4일 대만 (1):몇번 패키지 가봤는데 그럭저럭 괜찮아서 이번에 부모님 모시고 처음 해외여행을 하게됬습니다.
다리도 조금 불편하셔서 길게는 못하고 3박4일로 대만을 정했는데요
  호텔
츄토 프라자 호텔 타이페이 시내에서 1시간 가량 떨어진 타오위안 외곽에 있습니다. 모든 일정이 타이페이를 거치는 경론데 왜 다른 곳에 잡았는지 아직도 의문이네요 시간낭비
단체관광 위주 호텔인듯 실내는 쓸데없이 매우 큽니다 들어가자마자 쿰쿰한 냄새가 올라오고요
약간 낡은듯 했지만 그럭저럭 괜찮을거같았는데 밤되니 넓어서 난방이 커버를 못하구요 춥습니다
조식은 쓰레기급이네요 먹을것도 없고 그나마 소세지 계란도 냄새 납니다.
그냥 빵이랑 시리얼 먹었구요
특급호텔이라는 글자를 잘 모르나봐요
  가이드
일단 나이가 좀 있으신분이신데 일행들 나이대 때문에 배정됫는지는 잘모르겠네요
인상은 그닥 .. 농담도 그닥
설명은 잘해주시는데 졸려죽는줄 알았네요
물건을 파는지 추억을 파는지 모르겠는데 물건좀 그만 파셨으면 좋겠습니다...
버스에서 까지 파는건 좀 아니죠 기사분때문이라는데 여행사에서 이미 돈 드리지 않나요?안사면 그만이라지만 강매 수준의 분위기 조성
그리고 중간에 옵션 상품 맛사지 안받으니까 버스에서 30분 기다리라고 해놓고는 1시간 가량 소요되었고 몇시까지 주변 관광이라도 하고 오라고 했으면 더 좋았을거같네요
관광시간도 너무 짧고 수박 겉핥기식이 많네요 지우펀에서 기념품 하나도 못샀.. 사람이 많은 요일이면 30분이라도 더 줘서 여유롭게 즐기게 해주셔야하는데 뛰어다녔고요.
뭐 사야한다 뭐 사지말아야한다 여긴 이게좋다 이런 팁같은것도 없이 그냥 계약되어있는 가게만 주구장창 갑니다
요즘 인터넷에 얼마나 많은 정보가 있는데 아직까지 이런 구식 여행인가요?
  식사
전반적으로 다 맛없었네요
맛집 많다던데 노맛집만 골라가네요
첫날은 무슨 시장통인줄알았어요 정신없이 먹고
중간에 화장실 포함해서 30분도 안먹은거같네요
늦으면 눈치보이니까
  쇼핑4회
쇼핑4회 보석가게만 2번을 가고 마지막날 면세점은 왜 갑니까? 공항에도 있는데 굳이 껴넣고
그넘의 돌맹이 지긋지긋
  맛집다니고싶고 아기자기한 기념품 사고싶고 하신 분들은 자유여행 추천드립니다 
저도 자유로 다닐려고요 이제
패키지 아웃이다
   "
대만,"지인과 큰딸과 함께 다녀온 대만여행 (1):지인과 큰딸과 함께 즐거운 여행이였어요
손 노영 가이드님의 따뜻한 배려에 감사드리고  일정도 맘에 들었어요
손 노영 가이드님 감사합니다.
 "
대만,"유휘빈 가이드 선생님과 함께 한 대만여행 3박 4일 (1):유휘빈 가이드 선생님 과 저포함 11명이 함께 한 여행 즐거웠습니다.
4일 내내 비 예보였어서 걱정되었으나 흐린 날씨로 도리어 덥지 않고 적당하게 여행 잘 할 수 있었고
3일째 지우펀 갔을 때 비가 왔으나 평소에 지옥펀이라고 불릴정도로 사람이 많아서 고생하던 곳인데
비가 오는 바람에 사람이 많지 않았어서 우산 쓰고 다녔어도 도리어 구경하기 나았던 거 같습니다.
101 빌딩은 어머님들이 반응이 별로였어서 대신 시먼딩 거리에서 구경잘했고 피사(비휴)라고 불리는
동물 모형 옥으로 된거 잡화점에서 몇십만원에 팔던데 3만 5천원(대만 달러 590달러)정도 주고 비슷한
모형(옥은 아닐지라도) 잘 구입했네요. 화련까지 가기 쉽지 않았을텐데 패키지라서 열차타고 잘 다녀왔고
박물관 좋아하는 저는 고궁박물관 가이드님 설명 잘 듣고 책자도 사고 좋았는데 그곳도 교통이 좋지 않아서
자유여행으로 갔으면 고생했을 수도 있는데 편하게 잘 다녀왔습니다.
가이드 선생님 재미있으셨고, 같이 간 일행분들이 너무 좋았어서(패키지가 다 좋은데 일행 중 무개념이 하나 둘
계시면 너무 짜증나게 변할 수도 있는데 운이 좋았다는) 가이드 선생님 운, 날씨 운, 일행 운이 다 있었던
좋은 여행이었습니다.  "
대만,"필복신 가이드님 덕분에 대만여행 잘 하고 돌아왔습니다.:이 여행은 패키지 여행의 장점을 최대로 살린 여행이었습니다. 노팁, 노쇼핑이라서 아침에 여유있게 일어나 식사하고 준비해서 나가면 인상 좋고 착하게 생긴 기사님이 깨끗이 청소된 버스를 대기시켜 두고 있었습니다.  행선지로 이동하는 동안 아주 숙련된 필복신 가이드님이 꼭 봐야할 포인트를 설명해 주시고 그 관광지를 보고 나면 다음 장소 (식당 또는 관광지)로 이동하는데, 가이드님이 현지 사정을 아주 잘 알고 계시기 때문에 그 장소가 붐비기 전에 도착하여 여유있게 식사면 식사, 관광이면 관광을 즐길 수 있었습니다. 그 모든 것이 순조롭게 될 수 있도록 가이드 님은 분초를 다투며 노심초사 하며 식당 또는 버스 기사분과 연락을 하시며 애써 주셨어요.
비올 확률 100%라는 일기 예보 가운데서도 4인가족, 3남매, 연합군으로 구성된, 복 받은 저희 그룹은 가이드님 표현대로 ‘비 사이로 막가’면서 즐겁게 대만여행을 할 수 있었습니다. 가이드 님이 알려주신 기차여행, 비행기 여행 편하게 하는 꿀팁까지 더해져 더 편안한 여행을 할 수 있었던 것에 감사합니다. 같이 여행했던 분들 모두 시간을 잘 지키기 위해 노력하며, 서로 배려하며 좋은 여행 할 수 있어 감사했습니다. 3남매 팀, 연합군 팀 분들, 밤늦게 인천공항에 내려서 피곤한 가운데 짐 찾기에 바빠 작별인사를 제대로 못했는데, 혹시 이 글 보신다면 다들 건강하시고 행복하시기 바랍니다. ^^ 4인가족 엄마 드림"
대만,"대만여행에 임기응변의 진수 장성 가이드가 있었다.:대만여행에 임기응변의 진수 장성 가이드가 있었다.
손주들의 여름방학을 맞이하여 2019년 8월 7일부터 8월10일까지 3박4일 동안 대만으로 가족여행을 떠났다. 집사람과 손주들이 동행하였다. 이번에도 여행일정이 충실하고 여행비도 저렴한 노랑풍선의 신세를 지게 되었다.
사실 태풍이 몰아치는 계절이라 걱정이 많았다. 도착 2일째인 8월8일 05:28경.호텔 5층에서 세면을 하고 있을 때 자갈밭에 굴러가는 자동차가 흔들리듯 건물이 흔들거렸다. 강도 6,0인 지진이 일어난 것이다. 당황 스러웠으나 별일은 없었다. 도착 3일째는 태풍예보에 따라 관공서가 휴무로 들어가 공무원이 출퇴근을 하지 않게 되었다. 야류, 칠성담, 협곡, 기념관 등 대부분의 여행지가 출입이 통제되는 등 긴급 상황이 발생하였다.
다행인 것은 우리 가이드 (장성)씨가 선견자의 기지를 발휘하여 일정과 시간을 잘 조정하여 감에 따라 눈앞의 재난을 피하고 또 여행일정을 빠짐없이 잘 소화시켜 주었다. 태풍을 예상하여 첫날 야류, 시편, 지우편, 자오궁, 야시장 등의 일정을 마무리 하고 다음날 화련지방으로 출발하였다. 삼일째는 이미 다녀온곳은 여행이 통제 되었다. 우리는 재난을 피하게 된 것이다. 정말 고마운 사람이다. 우리보다 앞서 오거나 뒤에 오신 분들은 대부분의 관광지 출입이 제한되어 여행이 어려웠고 비행기가 이륙하지 못하여 대만에서 하룻밤을 더 묶었다고 한다.
제주도 하루방처럼 희규한 돌과 바위가 즐비한 야류의 바닷가, 석회석이 흘러 먹지 못한 물들이 흘러나오는 협곡을 따라 닦아진 도로 등은 다른 나라에 비해 좀 특이한 곳이었다. 시편에서는 소원을 풀어주는 풍등을 날려 중국식 샤마니즘을 체험하였고 지우편이나 야시장 등에서는 이 지방의 활기찬 모습을 엿 볼 수 있었다.
대만의 여행길을 추억으로 돌리면서 현명한 판단으로 여행길을 밝게 해준 장성씨에게 베스트 가이드라는 칭호를 주고싶다. (류정수)
 "
