country,contents
대만,"oz연합 대만 꽃할배 따라 꽉차고 실속있던 일정 2 ^^(관광지 사진):짧은 시간에 많은 곳을 갔는데요. 국립 고궁 박물관은 사진을 못찍게 해서 사진은 없지만 실제 유물이 어마어마 합니다. 중국에 유적지 건물이 있다면 거기에 채워질 유물은 모두 대만 고궁 박물관에 있다고 하네요. 장개석이 엄청 가지고 대만으로 왔다고 합니다. 옥배추랑 서태후가 썼다는 옥병풍이나 그시대의 보석들이 엄청 화려하고 멋져요유물양이 엄청나서 주요유물외에 3개월에 한번씩 전시품을 교환한다는데 다보려면 20년이 걸린데요^^
  중정 기념당 입니다. 장개석을 기리는 곳~~ 전시실안에 장개석이 타던 수재 방탄 캐딜락이 있어요^^
꽃할배 백일섭이 음료수 빼먹던 자판기도 한컷 찍어봤어요
충렬사 군인 교대식 매시간마다 있다는데 볼만합니다. 마네킹 같아요
대만의 랜드마트 101타워 입니다.89층 까지 37초만에 가는 세계에서 젤 빠른 엘리베이터 기네스 기록에
있다고 합니다. 야경도 멋지고 이거 옵션인데요 안가보시면 후회합니다. 세계최대 산호랑 가장비싼 빨강산호
지진에도 끄덕없게 건물을 지지해주는 660톤짜리 어마어마한 추도 건물속이 아닌 공개적인 공간에 있어
볼만합니다.캐릭터 너무 귀여워요^^


화련에선 어마어마한 태로각 협곡을 구경할수 있고요.  사진으로는 표현이 안되게 어마어마 합니다.
인공수공 망치,정만으로 협곡의 길을 뚫었다고 하고~ 그곳에서 공사하다 죽은 사람을 기리는 장춘사, 제비들이
자연적으로 생긴 바위구멍에 집을 짓고 사는 연자구, 장개석아들이 어머니를 기리는 마음에 새운 자모정
구경할수 있구요.  휴게소에서 먹는 망고 아이스크림 아주 맛나요

센과 치히로의 행방불명의 배경이 된 지우펀~ 앞에 바다도 보이고 멋진 풍경입니다. 여기선 땅콩 아이스
크림이랑 떡 꼭 사서 드셔보세요^^부드럽고 맛있어요^^

야류 지질공원~ 날씨가 좋아서 사진찍기 너무 좋았어요. 여왕바위는 사람이 너무 많이 사진 찍으려고 기다리는
바람에 지대루 못 찍었지만 이국적이고 멋진 자연의 작품들이 많아요. 이름도 각각 다 있구요.
옆 샛길엔 짝퉁으로 유명작품들 만들어놓은 곳도 있어요. 원래작품에서 사진찍으려면 너무 많이 기다려야 하거든요^^ 여왕 목이 약해져서 조만간 부서질수도 있다해서 깜찍공주라는 작품이 차기 인기작이라네요^^머리묶는 모
습이라는데~~비슷한것 같기도 해요

오면서 노천 온천에서 잠깐 몸두 담갔구요. 수영복수영모 있으셔야 하구요. 각질먹는 닥터 피쉬도 있고
수압의자도 있고 시간이 짧긴하지만 들어가 볼만 합니다.음료 무료 무제한 리필입니다. 생수빈통 하나
가져가세요. 망고주스가 젤 맛있더라구요

  용산사와 화시지 야시장은 바로옆에 있어요.  용산사는 불교.도교.유교 사당이 다같이 있는 특이한 곳이
구요 화시지 야시장은 대만 시민들의 먹거리와 다양한 삶을 볼수 있는 곳입니다. 한치도 맛있고 팥이 들어있는
붕어빵 같은것이 있는데 달지않으면서 맛있더라구요 멧돼지 소세지구이도 맛있다는데 배불러서 패스!!!
    대만은 옵션이 알차고 좋더라구요. 특히 발마사지 진짜 짱 좋아요. 일행들이 특히 감동한 옵션이구요.정말 시원
합니다. 그리고 대만에 왔는데 서문정 거리 안가보면 우리나라 가서 명동 안가본 기분이잖아요. 그래서 가이드님
졸라서 서문정까지 다녀왔어요. 일행 전원이 오케이 해야 된다고 했는데 다행이 다들 동의 하셨어요
  한류 영향으로 떡볶이등 한국 음식들 파는 곳들도 많고 에띠드나 페이스샵.이니스프리등 한국 브랜드 가계를
보니 뿌듯했습니다. 서문정에서 꼭 먹어야할 망고빙수, 지파이(닭튀김).버블티 까지 다 먹고서 대만 여행의
정점을 찍었습니다. 망고빙수 정말 부드럽고 달고 맛있어요. 지파이는 배가 불러서 못먹고 한국와서 먹었는데
생각보다 맛있어서 깜놀했구요. 버블티는 한국에서도 많이 먹어볼수 있는거라서 특이하지 않았지만 맛있었어요
서문정 옵션이 요런 음식들 포함하는 거라서 좋았어요. 따로 가려면 호텔이 타이페이 시내에서 좀 떨어진 곳
이라서 택시비만 8만원 들어갈 판이었는데 미달러 20불에 먹거리에 구경까지 다 마치니까 너무 좋더라구요.
  마지막으로 여신이 가이드님 너무 친절하고 밝은 분이셔서 정말 좋았습니다. 웬만하면 여행자 요구두 들어주실
려고 노력하고 알아봐 주시고 필수 쇼핑코스도 부담없이 가서 좋았고, 펑리수도 맛난거로 잘 사가지고 온것
같아요. 대만여행 이 상품 너무 괜찮은것 같아요. 가격도 다른 여행사에 비해 저렴하고요. 여행 잘 다녀왔습니다.
내년쯤 체코 프라하 동유럽쪽으로 여행 계획 있는데요 그때도 노랑풍선을 이용하려고 합니다. 지난번 서유럽도
너무 좋았거든요^^"
대만,"대만여행 갔다왔습니다.:재미있는 여행이었고 많은 추억을 만들고 왔습니다.
인원수를 적게 구성하여 미니버스로 이동했는데 그것이 참 좋았습니다.
가이드분도 아주 친절하고 상세하게 잘 해 주셨는데 죄송하게 이름이 생각이 안나네요..
제가 이름을 잘 기억을 못 해서...성이 특이하셨었다는 거 말고는 ㅠ.ㅠ
다만 노천온천 시간이 너무 짧았다는게 아쉬웠고 경극이 옵션에 있었는데 배우들이 쉬는 기간이라 보지 못한 것이 아쉬웠습니다.
그리고 날씨가 자주 변한다는 말씀을 안 해주셔서 가벼운 옷을 가져갔다가 그대로 들고 오기도 했네요
 생각보다 추워서 다운점퍼를 입고 다녔는데....
 더웠다 추웠다 비왔다 바람 불었다 해서 얇은 점퍼랑 다운 점퍼랑 다 가지고 다녔어요..
그거 말고는 모두 만족스러운 여행이었습니다.
여행이 끝나고 노랑풍선을 추천하고 싶냐고 언니가 묻더라구요 그렇다라고 말해줬습니다...
앞으로도 좋은 상품 부탁드립니다."
대만,"대만 여행 너무 좋았습니다!:2/19일 설연휴를 통해  부모님을 대만 패키지 여행을 보내드렸습니다.
처음엔 긴연휴라 다른지역을 보내드리려 했지만 광고를 보고 대만으로 결정을 하였습니다.
담당자였던 서정민씨의 상냥한상담으로  일정은 수월하게 진행할수 있었고 
현지 장환자 가이드께서 저희 부모님이 대만 식사에 적응을 못하셨는데
일정 후 과일도 가져다 주셨다고 합니다. 대만 관광지에 대한 설명도 친절하게 잘해주시고,
부모님께서 다녀와서 가이드 칭찬을 워낙 많이 하셔서 보내드린 저도 기쁘고 뿌듯했습니다.
처음 예약일정과 다른일정으로 서정민씨가 추천을 해줘서 걱정이 많이 되었었는데  다행이라는 생각이 듭니다.
친절하게 상담도와 주셔서 정말 감사하구요. 다음번엔 홍콩여행을 계획중인데 다시 한번 더 이용하도록 하겠습니다.
담당자님 가이드님 감사합니다~?
 "
대만,"너무 행복했던 대만여행:전국을 강타했던 꽃보다 할배 대만편의 영향으로 엄청난 인파가 대만 자유여행을 떠나고 있고 저도 마찬가지로 대만 자유여행을 계획하게 되었습니다. 가장 먼저 항공권 예약을 했습니다. 여러 곳을 비교해 보던 중 노랑풍선 항공권이 가격도 저렴하고 좋은 것 같아 예약을 하게 되었는데, 중국 동방항공으로 예약을 했습니다. 상해를 경유해가는 번거로움이 있지만 돌아오는 길에 72시간 무비자혜택으로 비자 없이 상해여행을 할 수 있고, 상해가 나름 전철도 잘 되어 있으며, 호텔비도 저렴해서 2박3일간의 상해여행을 덤으로 할 수 있었습니다.  
첫날 우리는 아침 일찍 인천공항으로 출발했고, 상해를 거쳐 대만으로 갔습니다. 이른 새벽 집에서 나와 저녁에 해가 질 때 드디어 신베이터우의 숙소에 체크인을 하게 되었습니다. 이 곳은 유황온천으로 유명한 곳인데, 저녁에 온천욕을 객실에서 즐길 수 있어서 좋았습니다. 바로 근처에 유명한 온천수라면집이 있었는데, 담백하고 맛있었습니다.


 둘째 날 아침 조식을 먹고 짐을 로비에 맡기고 호텔 근처의 신베이터우 도서관과 꽃할배에서 나온 노천온천 입구 그리고 온천박물관과 지열곡을 구경했습니다. 모든 곳이 가까이 있어 다 돌아보는데 한 시간도 안 걸렸습니다. 그리고 mrt를 타고 단수이로 향했습니다. 단수이에서 버스를 타고 홍마오청에 도착했습니다. 바로 근처에 대만영화 ‘말할 수 없는 비밀’의 촬영지인 담강 고등학교가 있고, 진리대학도 있어서 멋진 건물들을 볼 수 있었습니다. 근처에서 지파이도 맛보고, 유명한 차도 마시며, 바로 근처의 빠리섬으로 배를 타고 갔습니다. 섬에는 각종 튀김집과 과일가게가 여행자를 유혹하고 있었습니다. 우리는 다시 배를 타고 나와 시장구경을 했습니다. 유명한 펑리수와 사탕도 구입했습니다. 길에는 단수이에서 유명한 카스테라 파는 곳이 있었는데, 줄이 너무 길어서 차마 살 수가 없었습니다. mrt역 바로 옆에 위치한 미스터브라운 카페에서 커피를 한잔 더 마시고 신베이터우로 가서 짐을 찾아 우리의 다음 숙소인 중산역으로 향했습니다. 호텔에 체크인을 한 후 국부기념관 역으로 가서 저녁식사를 했습니다. 식사를 하고 근처 아이스몬스터에서 망고빙수를 먹었습니다. 꽃보다 할배에서 보고 꼭 가보고 싶었던 곳이었는데, 생망고가 들어가 정말 맛있고 얼음도 상당히 부드럽고 훌륭했습니다. 다음으로 용산사에 들렀는데, 그곳에서 지인을 만났습니다. 정말 대만자유여행의 인기를 실감할 수 있었습니다. 근처 야시장은 늦은 시간이었는데 사람들로 붐볐습니다.
  
  셋째 날 우리는 새벽에 일찍 일어났습니다. 7시 20분 기차로 화련으로 출발했습니다. 화련에서 택시투어를 했습니다. 정말 멋진 곳이었습니다. 화련의 협곡들과 함께 거대한 자연의 멋을 한껏 느낄 수 있었습니다. 우리는 기차를 타고 타이베이로 돌아와 101빌딩으로 갔습니다. 도착하니 9시가 다 되었습니다. 101빌딩 딘다이펑은 맛과 서비스가 모두 훌륭한데 9시가 너머서 가야 안 기다린다는 이야기를 듣고 늦게 가서 기다리지는 않았지만 여전히 사람들로 가득합니다. 이 곳에서 만두를 주문했는데, 저는 만둣국이 가장 인상적이었습니다. 그리고 101빌딩에 올라가 대만의 야경을 즐겼습니다.

 
넷째 날 유명한 고궁박물원으로 향했습니다. 유명한 옥배추 앞은 줄이 참 길었습니다. 정말 많은 사람들이 찾는 장소인데, 구경할 것이 참 많았습니다. 우리는 점심을 먹고 중정기념관으로 향했습니다. 이 곳은 날씨도 화창하고 여러 건물들이 멋지게 배치되어 있었습니다. 이 곳에 춘수관이라는 전주나이차 가게가 있습니다. 별 기대 없이 주문해서 마셨는데, 상당이 맛있었습니다. 그리고 시먼역으로 향했습니다. 이 곳에 영화박물관에서 구경도 하고, 까르푸에서 장도 보았습니다. 그 다음으로 동먼역의 융캉제에 들러 용캉우육면으로 저녁식사를 하고, 스무시 빙수를 먹었습니다. 스무시 빙수보다는 아이스몬스터의 빙수가 훨씬 맛있는 것 같습니다.
    다섯째 날 아침 우리는 짐을 챙겨 예약한 택시투어를 시작했습니다. 가장 먼저 간 곳은 예류입니다. 엄청 신기한 모습입니다. 많은 사람들이 여왕바위 앞에서 사진을 찍으려고 줄을 서서 기다립니다. 그런데 여왕바위 말고도 참 멋진 바위들이 많이 있고 바로 앞의 바다도 멋졌습니다. 다음으로 간 곳은 스펀이라는 곳입니다. 꽃보다 할배에서도 이 곳에서 천등에 소원을 적어 날리는 모습을 보았는데, 가보면 천등을 날리는 사람들로 가득하고 한국에서 오신분이 운영하는 가게도 있어서 신기했습니다. 이 곳에서 소원을 적고 날렸는데, 저는 대만여행에서 이 곳이 가장 기억에 남네요. 다음으로 진과스에 갔습니다. 이 곳에서 광부도시락으로 점심식사를 했는데, 기대이상으로 맛있었습니다. 황금박물관도 구경하고 일본사람들이 살았던 집들도 구경했습니다. 다음으로 간 곳은 지우펀입니다. 저희는 이 곳에 숙소를 예약해서 1박을 했습니다. 정말 사람들로 가득했습니다. 유명한 찻집 앞에는 사람들로 가득했고, 한국 사람들도 많았지만 일본, 홍콩 등 각지에서 온 사람들로 지우펀은 북적였습니다. 이렇게 마지막 밤을 보냈습니다.  
  여섯째날 아침 일찍 공항으로 가서 비행기를 타고 상해에 도착했습니다. 상해에서 자기부상열차를 탔는데, 엄청난 속도에 놀랐습니다. 그리고 전철 표를 사려고 하는데, 갑자기 어떤 아주머니께서 다가오셔서 아주 친절하게 우리에게 기계에서 발권을 해주시고 잔돌을 빼앗아 가셨습니다. 순간 상해에 온 것을 엄청 후회했습니다. 호텔을 구글지도를 통해 검색했는데, 지도가 잘못되어 엉뚱한 역에 내려 엉뚱한 곳에 가게 되었습니다. 제가 가져온 호텔의 중국어주소와 이름은 순서가 중국어가 아니어서 택시기사가 알지 못했습니다. 9시가 넘은 시간에 너무 당황스러웠습니다. 그 때 길가는 여자분에게 도움을 요청했는데, 그분이 택시를 잡고 호텔로 전화도 해주시고, 기사님한테 중국어로 설명도 해주셨습니다. 20분이 넘게 택시도 기다려주시고 도와주셔서 너무 미안하고 고마웠습니다. 대만사람들은 모두 다 친절했고 참 온화하고 평화로웠는데, 상해에서는 아주 친절한 분도 보았고 황당한 경우도 당했습니다. 결국 호텔에 체크인을 하고 편의점에서 새우탕 큰사발을 사서 저녁을 먹으려고 하는데, 젓가락이 없어 달라고하니 안에 있다는 손짓을 하며 편의점 직원이 마구 소리를 질렀습니다. 대만의 편의점과 다른 분위기에 좀 많이 놀랐습니다.
  일곱째 날 호텔에 조식이 포함되어 있지 않아 호텔 근처의 와가스라고 하는 카페에서 커피와 샌드위치를 먹었습니다. 전철로 갈 수 있는 수향마을인 치바오구쩐을 향해 출발했습니다. 전철역에서 멀지 않은 곳에 위치해 있었는데, 평일오전인데도 사람들로 가득했고 먹거리와 기념품 가게로 넘쳤습니다. 배를 타고 싶었지만 운행을 안 하는 것 같아 그냥 구경을 했습니다. 공중화장실을 찾아갔는데, 관리가 잘 되어있었습니다. 전철을 타고 예원으로 갔는데, 예원근처의 상점가가 엄청 화려하고 멋지네요. 예원 구경을 하고 바로 앞의 남상만두에서 만두를 사먹었습니다. 줄이 그리 길지 않아 줄을 서서 만두 한 통을 사서 앉을 곳이 없어 서서 먹었습니다. 만두가 맛있어서 좋았습니다. 신천지로 가서 대한민국 임시정부사청사를 방문했는데, 한국 관광객들로 가득했고, 힘들었던 일제 시대 나라를 위해 목숨 바치신 분들의 투지를 느낄 수 있었습니다. 근처의 신천지는 마치 유럽에 온 것처럼 건물들이 아담하고 운치 있었습니다. 신천지를 구경하고 프랑스조계지와 타이캉루를 걸어서 쭈욱 구경했습니다. 볼 것도 많고 예쁜 물건을 파는 곳과 멋진 찻집이 가득한 곳이었습니다. 다음으로 동방명주탑이 있는 빈장다다오에서 동방명주탑을 구경하고 맥주도 한 잔했습니다. 전철로 난징동루로 이동해서 사람들로 북적이는 난징동루와 인민광장역을 구경하고 우리는 나름 길었던 여행의 마지막 밤을 마무리 했습니다.
  
  여덟째 날 아침일찍 호텔 체크아웃을 하고 전철을 타고 푸동공항으로 향했습니다. 비행기를 타고 무사히 인천공항에 도착했습니다.  
비행기를 4번이나 탔는데, 연착이 한 번도 없이 잘 다녀왔네요. 대만이 자유여행하기에 좋은 것 같아요. 사람들도 다 친절하고 교통도 편리하고 겨울에도 따뜻합니다. 상해는 화려하고 멋지고 스케일이 있습니다. 덕분에 보너스로 상해여행을 하게 되었는데, 중국여행은 패키지여행이 좋은 것 같아요. 발권을 하고 출국일이 거의 다 되었을 때 동방항공에서 발권한 여행사를 통해 신청하면 자기부상열차 티켓을 주는 것을 듣고 노랑풍선 여행사에 문의를 했습니다. 다른 여러 여행사에서 같은 질문을 했을 때 그런 것이 없다고 안 해준 곳이 많다고 들었는데, 노랑풍선여행사에서 친절하게 알아봐주고 신청해주어서 자기부상열차 티켓을 받아 탈 수 있었습니다. 여러 가지로 신경써주시고 끝까지 최선을 다해 도와주셔서 즐거운 여행을 할 수 있었습니다. 노랑풍선여행사를 처음으로 이용했는데, 이용해보니 믿고 이용할 수 있는 여행사인 것 같습니다. 앞으로도 계속 이용하고 싶습니다."
대만,"꽃보다 대만 여행: 2014-12-25 09;10 대만/화련 여행을 다녀 왔습니다.  가격적인 메리트가 있어 노랑풍선을 선택했지만 H투어나 M투어에 비해 불편하지는 않을까 걱정을 했습니다. 여행 첫날 가이드 왕선생님을 만나면서 괜한 걱정을 했었구나 싶었습니다.. 3박 4일동안 비가 내려 춥게 느껴졌는데 숙소에 히터까지 준비해서 갔다주시고  일행분들까지 세심하게 챙겨주셔서 일정내내 불편함이 없었네요. 숙소였던  Mornach skyline Hotel은 넓은 객실에 주위에 편의점도 있었지만 궂은 날씨탓인지 곰팡이내가 났어요. 현지식은 별로 기대하지는 않았지만 그런대로 먹었습니다만 숙소였던 호텔의 조식은 영 호텔같지 않더라구요. 2014-12-28 마지막날까지  잘 진행해주신 왕가이드님 감사합니다.
 "
대만,"대만&홍콩&마카오 패키지의 꽃 가이드 위주의 후기.:9월 14일부터 9월 18일까지 대만&홍콩&마카오 다녀왔습니다.
저와 남편을 포함 총 6팀 13명이 함께 했습니다.
다들 처음 뵙는 분들이지만 4박5일동안 지내면서 서먹함도 없어지고
서로 애기도 나누면서 즐거웠습니다.
  패키지 여행에서 제일 중요한건 가이드입니다.
  대만의 김형규 가이드님 열의 있게 설명도 잘 해주시고, 유머 있으시고, 게다가 잘 생기셨어요.
옵션&쇼핑센터 강요 없으셨고, 항상 저희 시야에 게셔서 불안하지도 않았습니다.
지우펀에서 땅콩 아이스크림도 사주셨고, 먹고 남은 쓰레기까지 다 걷으셔서 버려주시고
귀찮았을수도 있는데 모든 질문에 대한 답변도 성의있게 해주셨어요..
같이 여행하신 분들 모두 김형규 가이드님 칭찬 일색이였습니다.
  홍콩의 김찬 가이드님은 대만 가이드님을(워낙 좋아서..) 그립게 하긴했지만 그래도 좋았습니다.
시간 정해주시고 제 시간에 딱 나타나신 가이드님.
그래서 제 시간보다 먼저 모인 우리를 기다리게도 하셨지만 늦진 않으셨으니.
옵션 강요도 전혀 없으셨고 쇼핑센터에서의 강요도 전혀 없으셨습니다.
흥미있는 말씀 해주셔서 좋았습니다.
  마지막 마카오 이호찬 가이드님도 너무 좋았습니다.
우렁찬 목소리로 귀에 속속 들어오게 설명 잘 해주셨고 재미있으시고
그리고 진짜 사진 정말 예술로 찍어주십니다.
본인 몸을 구겨가며 각도 잘 잡으셔서 어찌나 잘 찍어주시던지 사진 잘 찍는 팁도 알려주시고
가이드님이 사진 너무 잘 찍어주셔서 액자 만들 생각입니다.
마카오 일정이 너무 짧아 가이드님과 오래 하지 못해 아쉬울정도...
다음에 마카오 가면 이호찬 가이드님으로 콕 찝어서 가려고요.. 너무 감사했습니다.
  3개국을 돌아다니기엔 너무 짧은 일정이었지만 나름 만족합니다.
남편은 대만에서의 현지식과 조식이 입에 맞지 않아 좀 불편했고
홍콩은 습하고 덥지만 하루 머문 호텔이 깨끗하고 조식이 좋았습니다.
마카오는 홍콩에서 배타고 갈때 멀미를 하긴했지만  머문 시간이 너무 짧아 아쉬워서 나중에 다시 갈 예정입니다.
  이렇게해서 패키지의 꽃 가이드 위주의 후기였습니다."
대만,"알찬 대만 여행~^^:힘든 일정을 겨우 맞춰 아이와 함께한 대만 여행. 2박 3일이었지만 생각보다 알찬 일정에 감동했습니다.
가이드가 너무 어른에 맞추어 설명을 하시거나 예능에 능하시면 어쩌나.. 걱정을 했는데
우가이드님은 아이의 수준에 맞추어 친절하게 설명도 잘 해주셨고
여행자들에게 배려도 잘해주시는 분이었습니다.
가이드 경력 20년이라고 하셨으니 척하면 착하고 알아채셨겠지만
여행시작부터 숙소에 들때까지 엄마처람 꼼꼼이 잘 챙겨주셨답니다.
덕분에 무사히 잘 다녀왔고 무엇보다 아이가 즐거운 여행이라고 기분 좋아헤서 저도 좋았습니다.
다음 겨울 여행도 노랑풍선과 함께 해야 겠습니다.^^
아직도 머리와 가슴에 여행에 대한 추억이 남아 즐겁습니다.
노랑풍선 직원분들도 친절히 설명 잘 해 주셨고
좋은 정보로 여행준비도 잘했습니다.
화이팅 노랑풍선!!^^
 "
대만,"8월6일~9일 대만 CI연합 3박4일 대만여행 후기:8월 6일부터 9일까지 중화항공 연합 패키지 상품 일정을 노랑풍선을 통해 대만 여행 다녀온 후기입니다 ~~~ 
  처음으로 대만 여행가는것이라 긴장도 되어 여러번 대만담당자 서정민씨에게 질문도 많이 했지만 전혀 싫은 내색없이 친절하게 답변해주었습니다. 날씨가 더워서 조금 힘들었지만 곡충량 가이드를 만나서 너무 행복했고 친절하게 설명도 자세하게 해주셔서 여행이 너무 즐거웠습니다.
여행 내내 비가 온다는 소식에 약간 우울해 있었는데 활기찬 가이드님을 만나서 너무너무 즐겁게 그리고 어찌나 날씨도 도와주던지~ 야류에서 멋진 풍경을 볼 수있어서 너무나 좋았습니다.
  둘째날 저희 점심 식사 챙겨준다고 가이드님은 식사도 못하셨는데도 열심히 마이크로 끝까지 대만에 대한 좋은 인상을 남겨주셨습니다. 다음번에 부모님 보내드릴려고 하는데 그때도 꼭 곡충량 가이드님으로 부탁드려요 ~~~
짧은 일정을 알차고 즐겁게 보내게 해주셔서 너무너무 감사하구요~ 다음번에 꼭 다른 일정으로 한번 더 방문할께요 ^^

 "
대만,"8월7일~9일 2박3일 대만여행 후기~:8월7일부터 9일까지 2박3일의 패키지 대만여행 후기입니다.
아침일찍부터 일정이 시작되어 다소 빡빡한 스케쥴에 케세이퍼시픽항공의 내맘대로식 비행지연이 금상첨화되어 출발전부터 다소 난관이 예상되는 찝찝한 기분이었습니다.
그러나 현지에 도착하여 스케쥴을 진행하면 할수록 출발전 우려했던 부분은 안개가 걷히듯 점차 사라져가기 시작했습니다. 그것은 바로 가이드님의 편안한 진행 덕분이었던것 같습니다. 여러나라의 패키지 여행 경험결과 제게 항상 가이드의 이미지는 닳고 닳은 기가막힌 설명과 업무진행으로 상업적 냄새가 너무 심하거나 아니면 완전히 반대로 매사에 미덥고 부족해 불만이 자꾸만 쌓여가는, 그 딱 두가지의 틀안에서 벗어나지 않았었습니다.
그런 제게 이번에 서지희 가이드님이 그틀을 과감히 깨주었습니다. 너무 과하지도 않은 뒤쳐지지도 않은 차분하고 편안한 진행에 진심으로 사람을 대해주는 모습이 너무 좋았습니다. 각 상황속에서 고객의 심리가 어떠할지 제대로 알고 대해주어서 더욱 와닿을수 있었던 것 같아요. 예쁜 미모만큼이나 마음씨도 예쁜 가이드님 덕분에 빡빡한 스케쥴도 무리없이 완수할수 있었습니다.
개인적으로 제가 가끔씩 곡도 쓰는데 이번여행에서 이런 좋은 느낌을 가지고 좋은 영감으로 좋은 곡과 좋은 가사가 나올수 있었습니다. 여러모로 서지희 가이드님 감사해요~~^^"
