country,cleaned_sentences
필리핀,보라카이 여행 즐겁다 프랭크 라이언 보라카이 여행 다녀오다 만족스럽다 여행 여행 자유여행 패키지 다녀오다 공항 내다 만나다 헤어지다 많다 추억 만들다 오다 선택 관광 기억 남다 마사지 받다 한국 받다 좋다 몰다 투어 바퀴 돌다 알다 돌아다니다 사진 찍기 좋다 패키지 중간 중간 자유시간 좋다 프랭크 라이언 진짜진짜 행복하다 여행 만들다 주다 감사하다 사진 투척 갈다 스테이션 화이트 비치 스테이션 녹조 투어 가다 전망 끝내주다 푸카 비치 노을 진짜 이뿌다
필리핀,보라카이 카라 언니 덕분 행복하다 11일 5일 친하다 친구 해외여행 다녀오다 처음 깔리다 공항 내리다 늦다 어떻다 걱정 앞서다 상태 현지 카라 만나다 되어다 처음 만남 어색하다 풀다 보라카이 특성 설명 주시 늦다 친절하다 주다 좋다 모든 일정 여자 일행 배려 주시 취향 맞다 일정 조율 주시 편하다 해주다 의미 재밋는 여행 보라카이 가게 이용 겠다
필리핀,보라카이 여행 에덴 감사 안녕하다 즐겁다 보라카이 여행 일상 돌아오다 처음 출발 에어아시아 제스트 항공 지연 상당 되어다 짜증 나다 우울하다 보라카이 2일 잊다 돌아오다 현지 해주다 에덴 첫인상 귀엽다 유머러스하다 새벽 도착 버스 이동 내내 웃다 웃기다 채영 계속 신경 써다 주신 부분 감사 인사 싶다 남기다 가다 채영 마지막 와락 안기다 대기 삼촌 계속 안부 물다 오다 불쇼 사주다 야광 신나다 가지 놀다 타이 지도 짧다 효율 재미있다 보내다 해주다 진심 감사 드리다 기회 만나다 더더 즐겁다 보내다 는걸 덥다 날씨 고생
필리핀,행복하다 4일 보라카이 여행 보라카이 다녀오다 벌써 일주일 지나다 일만 축적 스트레스 풀겸 힐링 찾다 보라카이 엿는데 도착 오다 기분 우울하다 아침 3일 햇빛 해외여행 설레다 무섭다 기도 개리 덕분 4일 행복하다 개리 신경 쓰다 느껴지다 주다 제일 중요하다 안전 서도 항상 행동 니당다 맛있다 사주다 무기 돌아가다 좋다 경험 이끌다 덕분 언니 행복하다 추억 만들다 패키지 안좋다 많다 상품 강요 듣다 가다 끄다 늘다 개리 전혀 다르다 4일 정도 들다 곱다 한국 돌아오다 싫다 좋다 보라카이 찾다 싶다 보라카이 무조건 이용 당연하다 개리 히힛 개리 건지다 사진 한장 투척 개리 비치 랍니당 잊다
필리핀,보라카이 데이 리차드 남자친구 처음 가다 해외여행 설레임 걱정 데이 항상 먹다 자리 신경 써다 배정 해주다 불편 지내다 리차드 남자친구 동갑 마주치다 친구 친구 웃다 패키지 여행 한인식 분덕 바꾸다 좋다 기회 보라카이 그립다 우울하다 데이 말씀 남자친구 결혼 노력 칭찬 해주다 감사하다 달다 보라카이 감사하다
필리핀,보라카이 가족 친구 강추 물가 저렴하다 부산 오다 편안하다 음식 불편하다 다녀오다 많다 미리 알아보다 자유여행 친구 편하다 오기 좋다 여행 즐겁다 놀다 마사지 받다 즐겁다 날씨 좋다 날씨 도와주다 여행 처음 패키지 자유여행 가다 싶다
필리핀,2015 12 15 보라카이 여행 안녕하다 여행 후기 늦다 올리다 친구 뜨다 따다 보라카이 여행 영종도 100 추돌 동반 담날 뱅기 연착 오밤중 도착 유머 재치 의로 되어다 마사지 좋다 해변 클럽 진짜 스트레스 확풀 오다 방문 싶다 저렴하다 여행 일정 말다 올려주다
필리핀,보라카이 제롬 파토 여행사 최고 자매 끼리 가다 여행 가다 검색 검색 99 안좋다 상한 만나다 걱정 패키지 어울리다 걱정 돼다 절대 걱정 말다 후회 절대 제롬 파토 만나다 여행 즐겁다 맞다 객관 적다 제롬 삼촌 일일이 챙기다 몰다 모르다 파토 도움 받다 해주다 자유여행 호핑 투어 체험 다른사람 강제 하라 강요 솔직하다 싶다 동생 절대 호핑투어 체험 자고 하라 신뢰 가다 100 신뢰 가다 짱짱 제롬 받다 먹다 없슴돠 재미있다 맛집 맛있다 주의 사항 자다 알다 클럽 어디가 재미있다 알다 주심 놀다 끄다 멜라 5일 패키지 노랗다 담당자 전화 서다 그랜드 비스타 업그레이드 해주다 별로 싶다 강력 추천 해주다 그랜드 후회 뻔하다 좋다 좋다 후회 업글 해주다 무조건 그랜드 비스타 수영장 필요없다 요기 끄다 멜라 리조트 화이트 비치 가깝다 저녁 색깔 바뀌다 호핑 투어 나서다 출출하다 망고 맛있다 망고 터지다 먹다 분위기 진짜 좋다 사진 일링 보트 가다 사진 무섭다 걱정 무게 나가다 걱정 튼튼하다 아이폰 찍다 사진 나오다 끄다 멜라 리조트 화이트 비치 먹다 말로 설명 최고 제롬 맥주 사주다 분위기 좋다 먹다 밥맛 최고 술맛 최고 마지막 헤어지다 기전 공항 찍다 사진 다리다 사기 어쨋 2일 6일 5일 최고 최고 그랜드 비스타 리조트 몰다 멀다 좋다 끄다 멜라 리조트 냄새 나다 비치 빌리다 50 페소 내야 방이 어둡다 화이트 수영 바라보다 필요없다 굉장하다 친절하다 대신 여자 직원 별로 친절하다 남자 직원 친절하다 조식 맛없다 끄다 멜라 조식 나름 괜찮다 가격 저렴하다 정해지다 상품 좋다 굿굿 6월 보라카이 갈껀데 제롬 좋다 좋다 보라카이 갈다
필리핀,설날 보라카이 캘리 터키 힐링 이렇다 설날 제일 좋아하다 친구 필리핀 보라카이 가게 되어다 비행기 에어아시아 타고 나르다 깔리다 도착 도착 먼저 무릎 오다 뚜거운 기다 패딩 하얗다 스웨터 벗다 캐리어 넣다 비행기 내리다 필리핀 날씨 후끈하다 열기 겨드랑이 나다 이쁘다 캘리 만나다 보라카이 3일 세계 대다 비치 보라카이 체험 실컷 체험 스킨 스쿠버 다이빙 호핑 투어 버그 마사지 선셋 일링 파랗다 일링 익사 펀하다 에피소드 이중 익사 체험 스킨 스쿠버다이빙 재미있다 에매랄드 가지다 바다 헤엄 종류 물고기 느낌 스폰지밥 느낌 해파리 사냥 불가사리 만나다 느낌 말미잘 사이 놀다 조그마하다 니모 발견 바다 생물 다큐멘터리 티비 느낌 들다 멀다 티비 들어오다 느낌 신기하다 만지다 오리발 흔들다 만지다 말미잘 만지다 산호 만지다 구멍 숭숭 돌맹이 만지다 말미잘 만지다 손바닥 뾱뾱 달라붙다 웃기다 웃다 수경 들어오다 당황 말미잘 괴롭히다 친구 손짓 만지다 친구 말미잘 손바닥 뾱뾱 달라붙다 필리핀 다이버 조각 주다 물고기 기다리다 흠칫 검다 세모 물고기 엄지 손톱 크다 물리다 흠칫 용기 내다 물고기 뻗다 예상 적중 물다 아프다 물고기 이빨 느끼다 난중 손앞 뻐끔뻐끔 거리 면서 먹다 납닥 물고기 귀엽다 손가락 톡톡 물고기 만지다 재미있다 경험 멋지다 추억 스킨 스쿠버 다이빙 그다음 힐링 되어다 체험 스톤 마사지 대박 잠귀 밝다 버리다 따뜻하다 데우다 뭉치다 다리 어깨 꾹꾹 눌리 따다 원하다 돌이 정도 식다 오일이 발린 몸위 따뜻하다 질문 지다 뜨다 뜨끈하다 난중 필리핀 마사지 사들이다 덥다 에어콘 켜다 정중하다 부탁 에어콘 끄다 달라 쏘다 오프 에어콘 리즈 맞다 표현 틀다 번년 한국 추위 뜨다 뜨다 좋다 말다 후회 만족스럽다 마사지 마사지 받다 잠자다 처음 쿨쿨 자다 필리핀 보라카이 힐링 즐기다 2013년 4월 터키 가다 운동 오다 10 하루 빼먹다 새벽별 호텔 나가다 별보 면서 호텔 들어오다 빡시다 돌아다니다 재미있다 타고 갈다 마다 터키 역사 한국 형제 나라 설명 해주시 한국 모습 찍다 오다 알차다 터키 여행 필리핀 여행 마찬가지 아침 일어나서 체험 시작 몰이 해변 맛집 소리 빵빵 클럽 돌아다니다 클럽 가다 춤추다 엉덩이 머리 흔들다 마사지 금방 받다 오다 원점 추다 추다 어떻다 몸매 이쁘다 어떻다 휴양지 눈치 안보 놀다 휴양지 보라카이 가다 캘리 쫄쫄 따라다니다 모르다 물어보다 친절하다 갈다 켜다 감사하다 자다 가르다 주다 자유여행 정도 보라카이 풍경 야자수 해변 그리다 기다 그립다 캘리 필리핀 포토 그래퍼 마이클 마크 그립다 4일 짧다 여정 정이 들다 고참 그립다 새벽 홈페이지 들어오다 후기 캘리 마이클 마크 만나다 오다 좋다 여행 찍다 사진 그리다 캘리 자다 해주다 감사하다 캘리 화이팅 화이팅 하트뿅뿅
필리핀,캘리 세계 태마 여행 티비 보라카이 힐링 여행 설날 좋아하다 친구 필리핀 보라카이 다녀오다 티비 로만 모습 실제 느낌 티비 프로그램 세계 태마 여행 티비 들어가다 느낌 들다 사계절 따뜻하다 여름 보라카이 모습 방기 설레다 새롭다 크다 타고 가다 풍경 색다르다 티비 거리 풍경 똑같다 야자수 희다 모래알 해변 걸다 지다 요트 타고 나아가다 멋지다 추억 생기다 서민 풍경 아름답다
필리핀,환상 보라카이 4일 자세하다 작성 환상 보라카이 사진 보라카이 바다 연휴 기다 해외여행 갈다 고민 보라카이 가게 되어다 달다 예약 설레다 떠나다 보라카이 4일 여정 떠나다 되어다 2월 20일 1일 인천공항 미팅 장소 카운터 19 20 도착 정표 항공 받다 사진 필리핀항공 11시 30분 필리핀항공 출발 3시 필리핀 깔리다 공항 도착 사진 깔리다 공항 필리핀항공 비행기 공항 도착 푯말 써다 이름 써다 푯말 들다 지인 만나다 한국 데이빗 미팅 버스 탑승 대략 1시간 반정 버스 타고 달리 보라카이 주의 조심하다 안전 전해 들다 보라카이 지역 다르다 소지 안되다 치안 안전하다 3분 조심하다 거지 삐끼 잡상인 3분 조심하다 듣다 보라카이 가다 항구 도착 타고 15분 20분 슝슝 타고 가다 보라카이 도착 사진 필리핀 지식 도착 해보다 6시 넘다 되어다 석식 현지 도착 지식 몰다 식당 들어가다 식사 끝내다 끄다 멜라 리조트 체크 끄다 멜라 신관 구관 나누다 지다 숙박 신관 신관 시설 깨끗하다 좋다 와이파이 호텔 로비 터지다 아쉽다 1일 일정 끝나다 2일 2월 21일 아침 끄다 멜라 리조트 조식 먹다 로비 12시 만나다 호핑투어 가다 사진 호핑투어 잡히다 물고기 사진 스노 쿨링 먼저 타고 낚시 물고기 잡고 마리 잡다 소질 마리 못자다 낚시 스노 쿨링 고고싱 스노 쿨링 보라카이 바다 아름답다 사진 돼지고기 망고 스노 쿨링 물놀이 금방 고프다 데이빗 문어 돼지고기 제공 해주다 배다 먹다 더욱 꿀맛 호핑투어 끝내다 마사지 고고싱 선택 옵션 마사지 선택 마사지 업그레이드 해주다 진주 황제 마사지 무료 받다 사진 불쇼 마사지 받다 저녁 몽골리안 바닷가 먹다 저녁 먹다 불쇼 구경 멋지다 타임 사진 망고 아이스크림 저녁식사 끝내다 몰다 투어 데이빗 추천 해주다 망고 아이스크림 사먹다 꿀맛 2일 일정 끝나다 3일 2월 22일 아침 10시 로비 데이빗 만나다 선택 옵션 선택 파랗다 일링 가게 되어다 사진 보이시 는바 연결하다 띄우다 태우다 달리다 스피드 보트 낙하산 타고 하늘 올라가다 스릴 만점 하늘 바라보다 보라카이 바다 말로 표현 아름답다 하늘 기분 선택 옵션 후회 파랗다 일링 친해지다 현지 친구 아쉽다 이별 뒤로 갈아입다 리조트 들리다 점심식사 폭립 먹다 우리나라 먹다 폭립 살이 통통하다 맛있다 점심식사 끝내다 투어 고고싱 제트 보트 타고 보라카이 바다 질주 재미있다 이간 남자친구 제트 보트 제일 기억 남다 라그 제트 보트 타고 버기카 고고싱 타고 전망 올라가다 보라카이 한눈 그다음 저녁 삼겹살 먹다 일링 보트 연료 운전 필리핀 친구 잇다 보이다 일링 보트 타고 나서다 마사지 이동 라마 스톤 마사지 2시간 정도 받다 온몸 전율 마사지 한국인 운영 깨끗하다 마사지 해주다 지인 친절하다 받다 내내 기분 좋다 마사지 받다 3일 일정 끝나다 4일 2월 23일 아침 9시 30분 로비 데이빗 만나다 깔리다 공항 출발 타고 내다 버스 2시간 슝슝 달리다 필리핀 문화 보라카이 내용 2시간 지루하다 데이빗 친철 애기 해주다 버스 내다 점심 한식 먹다 점심 먹다 쇼핑 센터 가게 되어다 패키지 다르다 한눈 필요하다 쏙쏙 살수 들다 설명 듣다 필요하다 쏙쏙 데이빗 알다 가산 물건 코코넛 증류 노니 비누 망고 코코넛오일 구매 쇼핑 센터 쇼핑 끝내다 아쉽다 마음 뒤로 고국 갈다 준비 공항 우리나라 버스 터미널 느낌 마사지 30분 우리나라 6천원 받다 금방 지나가다 보라 4일 일정 일정 나다 해보다 좋다 가득하다 한가지 아쉽다 호텔 와이파이 안되다 아쉽다 다르다 체적 만족 그요 한국 패키지 내용 많다 즐겁다 여행 5월 홍콩 마카오 대만 패키지 일정 나오다 통해 가다 그요 여행 책임지다 좋다 추억 여행 만들다 감사하다 카이 사진 몇장 추가
필리핀,에덴 최영민 감동 케어 보라카이 오다 매년 차례 해외여행 떠나다 가족 2월 5일 5일 보라카이 여행 다녀오다 가다 길이 걸리다 험하다 고해 꺼리다 세계 대다 비치 아름답다 화이트 비치 황홀하다 5일 보내다 오다 최영민 감동 연속 뜨다 케어 해주다 가다 이름 먼저 부르다 확인 호핑투어때 미리 잡다 물고기 걸다 두다 낚시 건네주다 맛사지 코코아 사다 오다 진주 브로치 선물 해주다 쓸다 맛사지 굉장하다 불쾌하다 어리다 부부 맛사지 받다 계속 기다리다 되어다 짧다 신청 작전 어른 코코아 제공 받다 코코아 뜨겁다 내려놓다 사이 개미 마리 빠지다 먹다 되어다 맛사지 끝나다 사정 얘기 코코아 물다 인색하다 어쩜 자르다 완전하다 정상 소파 앉다 투덜대다 남편 오다 가다 신경 돌리다 에덴 나타나다 코코아 들다 직접 사오다 화색 돌다 마음 풀어지다 다시다 가기 싫다 맛사지 패키지 가다 26 가족 유일하다 옵션 제일 적다 신청 거기 서다 일절 신경 쓰다 오다 이쁘다 해주다 옵션 밝히다 차별 삼촌 삼고 싶다 훌륭하다 인성 가다 불다 한국 오다 에덴 고마움 가족 보라카이 완전하다 떠나오다 기다 여운 남다 해주다 에덴 깊다 감사 드리다
필리핀,보라카이 만난 박태 브라이언 감사하다 떠나다 가족 여행 차다 친절하다 불편 해주다 가족 행복하다 즐겁다 자다 지내다 돌아오다 스킨 쿠버 호핑 투어 파랗다 일링 재미있다 좋다 추억 되어다 무궁 발전 기원 여행사 발전 기원
필리핀,필리핀 보라카이 여행 좋다 추억 만들다 돌아오다 필리핀 보라카이 여행 좋다 추억 만들다 감사하다 사진 필리핀 보라카이 해변 화이트 비치 스마트폰 카메라 촬영 사진 여행 준비 도움 바램 여행 감사하다 적다 싶다 올리다 필리핀 항공 이용 숙소 파라다이스 가든 이용 필리핀 항공 갈다 1시간 가량 오다 2시간 연착 되어다 여행 일정 크게 지장 정도 연착 다행 갈다 오다 기내식 나오다 한국인 승무원 계시다 의사소통 도움 되어다 식사 메뉴 음료 선택 정도 관련 기내식 괜찮다 메뉴 스파게티 나오다 소스 부족하다 어른 비다 아쉽다 필리핀 깔리다 공항 도착 비행기 착륙 흔들리다 우리나라 비다 비행기 착륙 매끄럽다 주신 여행 물다 출입국 신고 세관 신고 검역 신고 쓰다 예시 자다 나오다 많다 도움 되어다 여행 일정 관련 자다 나오다 좋다 공항 처음 도착 추다 겨울 한국 달리 습하다 덥다 날씨 신선하다 느껴지다 나라 공항 달리 깔리다 공항 작고 기다 기다리다 개선 좋다 듭니 공항 나오다 마린 처음 만나다 인상 좋다 좋다 인상 깔끔하다 융통성 여행 일정 진행 주신 현지 로드 분도 처음 무겁다 들다 주시 안전하다 여행 도움 주다 감사하다 대가족 묶여서 여행 일정 다니다 되어다 가족 대다 가족 묶여서 다니다 점도 좋다 보라카이 이동 2시간 정도 버스 타고 끄다 끄다 부두 이동해 방카 보트 10분 정도 타고 보라카이 도착 기다 이동 지다 버스 이동 2시간 마린 필리핀 보라카이 여행 일정 상세 설명 해주다 도움 되어다 화이트 비치 담배 피우다 벌금 아두 좋다 흡연 가족 라면 도움 숙소 숙소 이름 적히다 이외 사용 체크 아웃 사용 부과 가지 숙소 물건 뜯다 사용 물기 일정 3일 오다 하루 날씨 맑다 3일 덥다 좋다 맑은 비만 계속 오다 갈다 파란 하늘 하얗다 모랫 바닷가 에메랄드 바다 바다 풍경 차다 좋다 날씨 맑다 대신 햇볕 뜨겁다 썬크림 자다 발라 주어 숙소 파라다이스 가다 깔끔하다 시설 괜찮다 조식 석식 먹다 숙소 좋다 해변 가다 놀다 오다 따뜻하다 물이 항상 자다 나오다 깔끔하다 숙소 공간 괜찮다 조식 서식 220 볼트 편리하다 사용 핸드폰 충전 청소 달라 손잡이 피켓 걸다 놓다 매일 수건 자다 교체 청소 깔끔하다 자다 되어다 좋다 커피 포트 구비 되어다 커피 끓이다 말다 좋다 숙소 비올 대비 우산도 비치 되어다 자다 사용 숙소 로비 와이파이 사용 좋다 숙소 안전 요원 계시다 안심 되어다 부분 파라다이스 가든 첫날 먹다 조식 조그만 케익 직접 주시 오믈렛 게란 라이 맛있다 석식 불쇼 멋지다 하룻밤 자고 몰다 투어 맛집 먹다 거리 물건 입시 유의 마린 자다 소개 주다 좋다 할로 위치 망고 빙수 먹다 맛있다 스테이크 먹다 싶다 먹다 보지 아쉽다 옐로우 피자 주문 저녁 먹다 화이트 비치 맥도날드 아이스크림 음료 먹다 스킨 스쿠버 다이빙 좋다 경험 설명 주시 분도 친절하다 현지 스쿠버 다이버 물방울 만들다 보여주다 물고기 산호 가까이 관찰 좋다 멋지다 스쿠버 다이빙 이징 자다 한국 오다 중이염 치료 받다 스킨 스쿠버 다이빙 이징 주의 자다 좋다 호핑 투어 낚시 스노우 쿨링 신랑 마리 잡다 마리 잡다 기념 사진 남기다 오다 현지 로드 사진 자다 찍다 주어 좋다 추억 자다 남다 망고 과일 잡다 물고기 치다 주다 자다 먹다 오다 푸드 중식 먹다 음식 아쉽다 먹다 망치 자다 쪼개다 주다 감사하다 저녁 먹다 베이비 자다 먹다 망고 주다 필리핀 망고 좋다 일링 보트 멀미 심하다 보지 좋다 몰다 투어 여러 가지 체험 관광 친절하다 자다 주시 안전하다 가족 자다 지키다 주다 감사하다 마지막 받다 황제 말다 신랑 마음 들다 말다 받다 자다 감사하다 출국 출국 수속 자다 설명 주다 종이 프린트 출국 순서 설명 좋다 중간 자다 모르다 부분 한국인 워낙 많다 알다 주시 물어 안내 프린트 수속 수월하다 좋다 듭니 우리나라 택시 크다 필리핀 국적 이면 색다르다 풍경 머리 맑은 화이트 비치 풍경 기억 안전하다 즐겁다 여행 좋다 추억 만들다 주신 마린 로드 감사 드리다 덕분 즐겁다 여행 되어다 여행 경비 빠듯하 가져가다 공항 출국 로드 드리다 싶다 마린 로드 새해 받다 승승장구 자다 기원
필리핀,제롬 로저 유쾌하다 보라카이 일정 1월 4일 8일 5일 일정 보라카이 다녀오다 기분 좋다 다녀오다 후기 남기다 동남아 처음 여행 걱정 대반 걱정 제일 패키지 상품 많다 부분 권유 강요 들어서다 여차하면 무시 출발했더랬 보라카이 도착 앞서 걱정 걱정 되어다 버리다 제롬 현지 저가 여행기 내내 친절하다 안내 해주다 갖가지 여행 주다 좋다 말주변 좋다 어색하다 첫날 반나절 제외 계속 웃다 즐겁다 여행 강요 기분 좋다 전혀 예정 스킨 스쿠버 투어 되어다 패키지 자다 만나다 더더 더더 더욱 좋다 팀원 좋다 한잔 말다 자고 즐겁다 가지다 사진 찍다 틀다 보라카이 다녀오다 잊다 매일 보내다 기분 좋다 여행 만들다 제롬 로저 후기 로라 고맙다 해주다 싶다 기분 좋다 여행 고맙다
필리핀,보라카이 여행 개리 도동 벌써 그리다 한국 돌아오다 보라카이 가다 싶다 다이빙 싶다 마사지 받다 싶다 날씨 좋다 재미있다 여행 개리 망고 식사 끝나다 사주다 맛있다 자다 먹다 감사하다 성실하다 빠르다 도동 그리다 자유여행 선호 친절하다 자다 안내 해주다 패키지 좋다 이미지 생기다 개리 자매 기억 놀다 갈다 망고스틴 사주다
필리핀,보라카이 12월 26일 4일 패키지 이용 솔직 후기 안녕하다 보라카이 4일 패키지 다녀오다 여행 올린다 솔직하다 실망 보라카이 전체 관광지 이기 항공 숙박 자유 관광 가능하다 여행지 그치다 처음 여행 여자 가기 무섭다 패키지 선택 되어다 4일 일정 첫날 오후 비행기 마지막 아침 비행기 2일 안되다 패키지 패키지 전체 일정 솔직하다 일정 제멋대로 바꾸다 실망 자유시간 표시 되어다 패키지 나름 계획성 전혀 일정 실망 문제 처음 출발 12월 12일 위메프 통해 구매 전화 오다 호핑투어 미리 예약 판매 확정 나머지 금액 입금 문자 전화통화 입금 예정 여권사진 보내다 확정 티켓 보내다 달라 알다 그치다 티켓 오지 출발 전날 연락 서다 입금 확인 날짜 불다 주다 확인 돼다 티켓 물다 끊다 나서다 출발 연락 출발 미팅 알다 오라 연락 받다 당연하다 해주다 알아보다 가다 홈페이지 나오다 핸드폰 번호 전화 번호 끼다 공항 때리다 본사 전화 전화번호 받다 가다 현장 계시다 티켓 받다 티켓 이상하다 가능하다 물다 보더 문제 나서다 발권 현장 가다 수화물 예약 안되다 당연하다 해외 나가다 20 알다 수화물 전혀 안되다 적히다 여행사 의하다 추가 3만원 내야 여행사 문의 처음 서다 친구 20 맞추다 보내다 여유 공항 도착 발권 나니 40분 안남다 발권 아시아 에어 셔틀 이용 뛰다 여행사 전화하다 전화하다 리가 여행사 가다 4시 55분 비행기 전화하다 4시 20분 가지 건지다 확인 전화 끊다 확인 전화 내용 잘못 항공사 실수 놓치다 부분 추가 부분 결제 내용 환불 해주다 이용 부분 이건 추가 비용 내다 환불 받다 환불 받다 원래 서비스 이용 이건 서비스 품목 원래 추가 요금 붙다 서비스 들어가다 부분 환불 안되다 여행 갈다 항공권 예약 수화물 서비스 넣다 주다 처음 듣다 항공권 예약 수화물 부분 체크 넣다 이해 돼다 해외여행 자주 가다 물어보다 이렇다 처음 답니 잘못 미안하다 나오다 여행사 잘못 티켓 안보 내주다 예약 티켓 확인 여행사 계속 확인 전화 주다 비행기 다가오다 전화 어떻다 찝찝하다 마음 비행기 타고 도착 항공권 재발 가지 연락 안되다 설명 해주다 바랬 많다 기대 일정 끝나다 메일 유선 연락 오다 아무렇다 반응 다시다 이용 안하렵니 광고 선전 투자 진짜 여행 높이다 직원 높이다 사과 보라카이 여행 후회 나머지 일정 정표 주다 일정 바꾸다 정표 주신 건지다 정표 첫날 호핑 투어 써다 선택 관광 장창 써다 패키지 일링 보트 마사지 몰다 투어 포함 되어다 그치다 일링 보트 마사지 포함 되어다 되어다 2일 일정 선택 관광 써다 나머지 자유시간 추천 선택 관광 신청 일정 바뀌다 선택 관광 일정 무시 선택 관광 일정 넣다 광고 모르다 최악 설명 자다 해주다 선택 관광 강요 그치다 여행사 나쁘다 정이 가지다 사과 상황 설명 부탁드리다 전화 받다 신분 이름 기억 설명 진짜 약관 나오다 약관 가지 오다 말씀 회사 방침 반복 처리 윗사람 돌리다 출발 직전 반복 해결 방안 제시 티켓 바꾸다 출발 직전 기분 망치다 여행 어떻다 즐겁다 참고
필리핀,보라카이 카라 강력 추천 보라카이 4일 가족 여행 가다 오다 보라카이 돌아오다 항공 문제 생기다 쬐다 고생 고객 최선 다해 주다 여행지 옵션 강요 항상 즐겁다 행복하다 여행 고객 편하다 배려 해주다 카라 많아지다 행복하다 여행 되어다 추하다 패키지 여행 어떻다 만나다 중요하다 변수 거들다 카라 감사하다 짱구 엄마
