country,cleaned_sentences
필리핀,7회 필리핀 마닐라 골프 채다 린지 투어 후기 안녕하다 7회 필리핀 마닐라 골프 채다 린지 투어 다녀오다 지난 태국 아유타야 골프대회 성공 마무리 필리핀 마닐라 골프대회 들다 드리다 마닐라 공항 숙소 알라 버스 20분 정도 걸리다 이동 편리하다 투숙 호텔 크림슨 호텔 크림슨 호텔 간단하다 소개 드리다 마닐라 크림슨 호텔 객실 345 객실 마닐라 위치 전체 세련되다 우아하다 분위기 호텔 호텔 내부 인테리어 스타 일리 모던 가구 이용 되어다 조화 이루다 부대 시설 무료 커피숍 카페 24시간 룸서비스 야외 수영장 피트니스 시설 비즈니스 센터 미팅 컨퍼런스 대형 컨퍼런스 드라이클리닝 세탁 서비스 마사지 객실 시설 객실 금고 고급 침구 목욕가운 무료 세면 용품 미니바 커튼 에어컨 전용 욕실 전화 책상 커피 헤어드라이어 2015 04 03 04 연습 운딩 본선 골프대회 진행 되어다 이글릿 이글릿 늘다 필리핀 유명하다 최고급 골프장 이자 크다 골프장 미국 골프장 설계 전설 꼽히다 피트 이의 아들 앤디 설계 일본 골프 황제 이사오 아오키 메이저 대회 관록 스윙 머신 영국 팔도 호주 백상어 그레그 노먼 명의 이름 붙이다 코스 디자인 72 288 124 코스 갖추다 크림슨 호텔 차량 40분 정도 소요 거리 위치 연습 운딩 신사 연습 실전 2015 04 04 7회 필리핀 마닐라 골프 채다 린지 투어 당일 대회 당일 화창하다 날씨 참가자 선전 기원 해주다 김명 영업 사업 부장 대회 안내 시작 활기차다 골프대회 시작 해보다 72 찬국 프로 대회 운영 안내 명일 대표 감사 안내 말씀 대표자 4분 시타 두다 두다 두다 카트 탑승 주시 추다 바알 대회 루고 모습 구경 가다 아름답다 대회 참가자 모습 나이스 사진 대회 베스트 포즈 사진 두둥 베스트 포즈 상감 대회 참가자 더욱 다이나믹 모습 기대하다 골프대회 만찬 진행 되어다 만찬 지난 대회 김명 영업 사업 부장 진행 시작 필리핀 전통 공연 분위기 국내 색소폰 연주가 단연 인자 꼽히다 서정근 교수 공연 준비 되어다 참가자 환호성 대단하다 행운 추첨 대회 시상식 진행 되어다 대회 어마어마하다 상품 기다리다 40 상품 준비 되어다 많다 수상 영예 수상하다 들다 축하 드리다 우승자 시상식 상품 무려 무려 데니스 코리아 골프 세트 아이언 세트 진심 축하 드리다 7회 필리핀 마닐라 골프 채다 린지 투어 마무리 되어다 대회 참석 자리 내주다 모든 감사 말씀 드리다 저번 대회 참여 해주다 대회 뵈다 무한 감동 느끼다 대회 더욱 업그레이드 대회 준비 많다 관심 부탁드리다 뵈다 그날 항상 행복하다 좋다 소식 가득하다 바라다
필리핀,11 필리핀 세부 다녀오다 친구 5일 다녀오다 처음 해외 여행 처음 인지 걱정 놀다 모르다 써다 덕분 빠지다 자다 놀다 즐기다 오다 단순하다 일정 조율 해주다 통역 해주다 관광 가다 역사 특징 쏙쏙 박히다 설명 해주다 이동 지루하다 즐겁다 유머 감각 센스 뛰어나다 해외여행 부족하다 부분 달러 페소 필요하다 모르다 챙기다 가다 부족하다 소환 개인 환전 10 정도 이서 귀찮다 아무렇다 표정 바꾸다 맥주 한잔 사주다 감사하다 한국 오시 저녁 사드 싶다 덕분 여행 즐겁다 감사하다
필리핀,필리핀 세부 김민석 다녀오다 주가 지나다 이제야 올리다 세부 김민석 덕분 안전하다 재미 여행 되어다 감사 드리다 싶다 남기다 세부 도착 양배추 환하다 웃다 반갑다 맞이 해주다 시작 느낌 좋다 보홀 들어가다 서다 짧다 보홀 세부 돌아오다 일행 반갑다 맞이 해주다 차다 기분 좋다 찌다 덥다 날씨 불구 세부 성적 상세 설명 해주다 모습 인상 깊다 덥다 덥다 점심 저녁 끼니 꼼꼼하다 취향 물다 자다 챙기다 감사하다 재미 얘기 해주시 친구 편하다 해주다 좋다 세부 가게 싶다
필리핀,즐겁다 필리핀 세부 여행 8월 19일 23일 5일 떠나다 여행 기간 두다 자세하다 알아보다 여행 떠나다 일요일 선택 월요일 확정 화요일 출발 떠나다 출발 홈페이지 커뮤니티 많다 대반 걱정 좋다 건지다 세부 도착 만나다 담당 데니스 친절하다 여행자 건의 사항 처리 해주다 수정 부분 적극 반영 여행 중요하다 식사 메뉴 선택 지식 한식 적절하다 맞추다 현지 식도 괜찮다 데려가다 여행 내내 배부르다 행복하다 다니다 일정 여행자 여성 2분 둘러보다 싶다 늦다 마다 위험하다 돌아다니다 주시 감동 쓰다 칭찬 써다 내려가다 5일 경험 해보다 스노 쿨링 스킨 스쿠버다이빙 스톤 마사지 낚시 들다 좋다 힐링 여행 좋다 처음 해외여행 일본 이용 굳다 만족
필리핀,즐겁다 필리핀 세부 제리 추천 가족 세부 여행 친철 엄마 아빠 친절하다 해주다 언니 재미있다 놀다 왔구욤 부모님 세부 여행 즐겁다 좋다 친구 찾다 세부 친구 후기 들다 진짜 던데 좋다 안좋다 안내 해주다 런가 즐겁다 재미있다 놀다 오다 제리 고맙다 받다
필리핀,태풍 람마 순이 필리핀 몰아치다 7월 19일 세부 여행 정이 확정 되어다 16일 오늘 람마순 복잡하다 19일 여행 가능하다 모르다 위험 20 21일 보상 구름 확인 필리핀 항공 결항 관광 가능하다 의문
필리핀,필리핀 세부 언닝 감사하다 필리핀 세부 여행 다녀오다 처음 사촌동생 가게 여행 기대 설레다 걱정 인천공항 10 00 비행기 타고 새벽 00 막탄 공항 도착 늦다 삼엄하다 막탄 공항 빠져나오다 언니 만나다 만남 편하다 해주다 언니 감사하다 들뜨다 마음 붙잡다 리조트 이동 벤픽 리조트 5일 지내다 모벤픽 리조트 좋다 짱짱 방도 깨끗하다 편하다 수영장 좋다 아침 조식 맛있다 벤픽 리조트 이비자 클럽 라이브 음악 들다 저녁 먹다 와인 칵테일 말다 분위기 대박 세부 모든 스케줄 지프니 재래시장 망고 망고스틴 산미구엘 맥주 스킨 스쿠버다이빙 불고기 레드 코코 야간수영 지프니 호핑 투어 스노 쿨링 낚시 푸드 마사지 김치 찌게 이비자 클럽 칵테일 퓨전 요리 세부 시내 관광 기념품 삼겹살 황제 스파 스톤 마사지 3일 모든 일정 막탄 공항 새벽 30 비행기 타고 인천공항 아침 00 컴백 일정 내내 편하다 해주다 언니 잊다 세부 여행 만들다 주다 감사하다 세부 여행 기약 오다 여행 가다 언니 감사하다
필리핀,24 28 필리핀 세부 코랄 포인트 리조트 제드 장석 강추 현재 오늘 아침 일정 돌아오다 정리 여행 후기 올리다 세부 가시다 제드 찾다 눈물 나다 알다 해주다 생생하다 후기 정리 올리다 세부 제드 장석 강추
필리핀,필리핀 세부 마리 바고 보리 마리 바고 전용 비치 한적하다 산책 아름답다 바다 슈퍼 사오다 산미구엘 맥주 마시다 마리 바고 조경이 예쁘다 크다 나무 많다 산책 좋다 크다 나무 해먹 눕다 크다 수영 바깥 활동 리조트 원하다 오다 고섬 호핑 투어 잡다 고래 물고기 여행 통틀어 제일 기억 남다 태평양 바다 물놀이 해외여행 기분 좋다 여행 남다 도와주다 보리 고맙다 여행 일정 서울 은서 즐겁다 한해 화이팅 좋다 인연 뵙다 바라다
필리핀,필리핀 세부 친절하다 90년 사이판 부부 결혼 20 주년 맞다 다녀오다 많다 여행 2년 집안 우환 힘드다 상황 고통 잊다 여행 4일 8일 필리핀 세부 보내다 필리핀 세부 막탄 공항 만난 제드 젊다 세련되다 말솜씨 친절하다 미소 인상 호감 세가족 안내 작다 인원 가족 가족 취향 생활 리듬 다르다 60 대다 50 대다 40 대다 서먹하다 분위기 간파 센스 재치 친절 필리핀 역사 유래 설명 노력 비다 세가족 여행 경험 많다 부가 기대 없슴 싫다 내색 배다 친절 잃다 순이 가깝다 가족 감동 주다 가족 마음 고맙다 감사하다 마음 하드 고요 젊다 성공하다 초심 잃다 말다 계속 화이팅 세부 가다 만나다 싶다 사랑 월낭 앞바다 호핑 스노우 크다 낚시 기억 싶다 다이빙 생각나다 오다 여행사 성공 기원 학년 반의 김용길
필리핀,엄마 필리핀 세부 여행 스카이 감사 드리다 쓰다 스카이 모르다 자다 계시다 엄마 둘이서 태풍 하이옌 오다 며칠 11월 12일 필리핀 세부 출발 걱정 되어다 현지 블로그 많다 출발 날씨 좋다 내내 따뜻하다 맑은 날씨 돌다 오기 싫다 태풍 들다 여행 취소 이서 다니다 되어다 좋다 기도 인솔 주신 스카이 말씀 재밌다 좋다 달랑 이서 죄송하다 여기다 호핑 투어 나가다 마을 투어 오다 연예인 화보 찍다 가도 자연 모습 살다 밝다 인사 해주다 필리핀 좋다 태풍 걱정 많다 많다 나라 자원 관광업 죽지 놀다 가다 맞다 들다 필리핀 7000 여개 피해 크다 우리나라 가다 보라카이 세부 괜찮다 서울 날씨 추워지다 가다 싶다 어제 필리핀 스파 끄다 스카이 자다 계시 공항 검색 들어가다 시야 사라지다 웃다 지켜보다 모습 잊혀지다 가다 싶다 건강하다 자다 바라다
필리핀,필리핀 바가지 김수권 고발 들다 바가지 당하다 말다 필리핀 마닐라 가시다 필독 필리핀 김수권 과장 5일 점심 저녂 진자 된장 찌게 김치 찌게 한국 5천원 먹다 음식 먹이 바가지 쒸우는 알다 살다 10 50 달라 달라 하내 50 60 폐소 살다 조용하다 가다 가라 우린 푸드 먹다 달다 푸드 대리 고가 음식 다사 아침 결제 하자 현지 필리핀 5일 신분 사기 당하다 푸드 먹다 20달러 이서 터지다 먹다 봉투 다리 패키지 일원 푸드 끄다 끄다 먹다 40달러 계산 가다 김수권 한국 싶다 문화 5000 폐소 115달러 두다 대다 알다 180 달러 받다 가다 아침 여자 도망 가버리다 이상하다 첫날 대다 가다 280달러 계산 150달러 충분하다 진자 읍내 그리다 바가지 쒸어 마닐라 그린 가다 거기 쇼핑몰 센터 크다 3일 돌아다니다 안대 가다 거기 목걸이 이미테이션 싸다 싸다 바가지 쒸울 한국인 장가 200 폐소 5달러 진주 목걸이 50달러 먹다 짝퉁 가방 1500 폐소 34달러 짜다 380달러 묵고 진자 자다 그리다 바가지 쒸어 따뜻하다 바가지 쒸운거 변상 내리다 필리핀 가시다 김수권 절대 만나다 말다 바가지 제왕 김수권
필리핀,특별하다 생생하다 필리핀 세부 여행기 특별하다 생생하다 필리핀 세부 여행기 기간 9월 25일 29일 5일 9월 25일 저녁 21시 55분 인천 국제공항 제주항공 타고 필리핀 세부 떠나다 인천 세부 3시간 30분 정도 시차 필리핀 1시간 느리다 세부 막탄 국제공항 도착 현지 바비 만나다 라미라다 리조트 이동 라미라다 리조트 사진 여행 라미라다 리조트 아침 조식 맛있다 먹다 세부 바다로 체험 다이빙 실전 들어가다 수영장 강습 받다 바닷 들어가다 스쿠버다이빙 체험 들어가다 짜다 두번째 제트 스키 최고 스피드 자랑 바다 제트 스키 오예 오전 세부 바다 해양스포츠 즐기다 리조트 돌아오다 라미라다 리조트 객실 소개 짜다 아늑하다 맛있다 점심식사 물놀이 수영장 고고 라미라다 수영장 하루 종일 물놀이 즐기다 세계 하나로 불리다 필리핀 게이 어메이징 관람 가다 공연 대기실 서다 사진 오빠 진짜 이쁘다 공연 림보 게임 뛰어나가다 신나다 여행객 림보 게임 즐기다 고프다 특전 레드 코코 레스토랑 특식 먹다 가다 레드 코코 레스토랑 필리핀 전통 민속 관람 필리핀 뷔페 디너 즐기다 레스토랑 여러가지 게임 필리핀 무용수 추다 필리핀 전통 여러가지 육류 해산물 바베큐 야채 과일 성하다 먹다 최고 최고 신나다 추다 먹다 특전 두번째 여행 피로 풀다 전통 맛사지 받다 가다 간지럽다 기도 맛사지 받다 하루 피로 풀리다 필리핀 세부 마무리 여행 세부 여행 메인 호핑투어 나서다 날씨 좋다 멀리 라미라다 리조트 찍다 지인 전통 방카 탑승 떠나다 세부 대표 해양 스포츠 뽑다 호핑투어 방카 4시간 주변 일주 스노 쿨링 낚시 즐기다 낚시 처음 재밌다 고프다 점심 푸드 먹다 대하 다양하다 푸드 열대과일 꿀맛 점심 맛있다 먹다 디스커버리 투어 즐기다 가다 크다 재래시장 맛있다 과일 사다 세부 모벤픽 호텔 묵다 조명 이쁘다 아깝다 바퀴 돌다 자다 아침 밝다 짜다 베란다 트이다 세부 바다 보이다 아침 일찍 조식 먹다 모벤픽 리조트 수영장 나오다 어제 분위기 전혀 다르다 넘다 이쁘다 수영장 물놀이 리조트 전용 비치 비치 나가다 외국 친구 사진 한장 모벤픽 리조트 모습 멋지다 마지막 일정 세부 시내 가다 세부 시내 마젤란 십자가 어거스틴 교회 패드 요새 볼거리 둘러보다 아쉽다 마음 정리 막탄 공항 가다 공항 가기 한식 들다 맛있다 김치찌개 먹다 맛있다 즐겁다 세부 5일 평생 잊다 즐겁다 여행 사랑 세부 떠나다 2012 0430 631 특별하다 생생하다 필리핀 세부 여행기
필리핀,필리핀 처음 추천 써다 가르치다 모든 정보 전달 전달 뛰어나다 대릭 나라 역사 나라 현지 실정 자다 이해 계시다 한국 현지 초대 받다 느낌 많다 정보 가지 계시다 들다 친절하다 천직 마냥 진심 느끼다 오다 여행 필리핀 칭찬 써다 본적 처음 칭찬 남다 대릭 진심 감사 드리다 고맙다
필리핀,필리핀 세부 자유여행 차다 좋다 8월 8일 8월 12일 필리핀 세부 자유 여행 차다 좋다 세부 도착 숙소 픽업 해주시 서비스 스톤 마사지 환상 일반 마사지 요구 마사지 접다 수준 높다 마사지 감사 드리다 일정 평안하다 즐겁다 여행 감사 드리다 자유여행 계획 고객 많다 관심 감사 드리다
필리핀,필리핀 클락 5일 스펙 여행지 역다 필리핀 마닐라 외곽 북쪽 2시간 정도 떨어지다 1991년 화산폭발 인하다 미군 철수 필리핀 정부 경제특구 지정 대통령 직속 관리 최근 북부 거점도시 문화 도시 발전 이루어지다 미니 캘리포니아 부르다 조건 갖추다 경제 휴양도시 날씨 계절풍 북서풍 시원하다 일조시간 덥다 열기 습도 불쾌감 장마철 태풍 영향 인하다 피해 적다 우기 11월 건기 12 5월 덥다 더러워지다 대기층 정화 줍다 스콜 현상 효과 따갈로그 필리핀어 아시아 미국인 필리핀 영어 통용 되어다 미국법 적용 전반 한국 적응하다 용이하다 4월 06일 719 21 40 부산 출발 00 40 클락 도착 미팅 로얄 호텔 투숙 4월 07일 로얄 호텔 조식 스펙 출발 클락 골프장 스펙 시작 기온 써다 37 올라가다 클락 골프 살인 햇빛 싸움 과언 대부분 오전 일찍 라운딩 권하다 아침 일찍 라운딩 조식 먹다 들어오다 골퍼 카트 타지 뜨겁다 햇빛 골프 진행 어렵다 카트 필수 레이크우드 클락 1시간 30분 위치 18 정규 골프장 무제한 운딩 가능 점심식사 골프장 스펙 진행 아시아 클락 1시간 20분 위치 18 정규 골프장 빌라 루시 따다 클락 공항 40분 위치 18 정규 골프장 경기 내부 스펙 불가하다 코리아 클락 공항 15분 위치 18 정규 골프장 경기 내부 스펙 불가하다 스펙 스테이크 석식 호텔 투숙 4월 08일 조식 스펙 출발 클락 박물관 병장 관람 수빅 이동 1시간 30분 클락 병장 한편 위치 박물관 과거 미군 지배 하의 필리핀 생활 개방 토요일 개방 오전 9시 오후 5시 역사 발자취 느끼다 장소 클락 차량 1시간 30분 달리 수빅 만날 가다 특별하다 볼거리 찾다 막상 다양하다 볼거리 존재 발레 호핑 투어 포인트 이동 푸드 중식 관계 호핑 투어 체험 아쉽다 원주민 체험 프로그램 관람 피우다 풋루 박쥐 차창 관광 부시맨 후예 생기다 원주민 생활 재현 해주다 지인 김병만 능가 솜씨 감탄 오션 어드벤쳐 지나 나무 메달 풋루박쥐 공원 조성 되어다 박쥐 서식 차창 관광 가능하다 클락 귀환 샤브샤브 석식 호텔 투숙 4월 09일 조식 스펙 출발 카트 체험 클락 카드 정식 명칭 길이 189 일반 아마추어 시속 90 스릴 즐기다 주말 개인 가져오다 내다 즐기다 레이서 클락 민속촌 나용 피다 피다 늘다 넓다 부지 필리핀 전통 가옥 진짜 성당 착각 모형 성당 시대 살다 모습 만들다 단체 여행객 들어오다 지인 직원 나오다 영어 설명 해주 이해 어렵다 홀리데이 호텔 스펙 프론트 객실 부대 시설 폰타나 리조트 빌라 워터파크 스펙 미모사 클락 공항 10분 위치 36 정규 골프장 빌라 스펙 션후 푸닝 이동 30분 도착 중식 동차 이용 협곡 트레킹 푸닝 온천 모래찜질 체험 화산폭발 인하다 만들어지다 용암 협곡 덜커덩 거리 차로 15분 정도 달리 만날 푸닝온천 출발 체험 클락 귀환 체크아웃 르네상스 호텔 스펙 아반떼 호텔 스펙 석식 공항 이동 4월 10일 720 01 50 클락 출발 06 20 부산 도착
필리핀,제발 필리핀 세부 여행 26 30 고맙다 신혼여행 여행 돼다 소리 듣다 민망하다 걱정 돼다 덕분 편안하다 즐겁다 여행 세부 즐겁다 지내다 다양하다 일정 해주다 좋다 동남아 좋다 휴양지 가보다 세부 무척 아름답다 멋있다 덕분 여행 갈다 고민 여행사 여행사 둘째 여행 세부 만나다 최고 여행 항상 건강하다 오다 여름 만나다 제발
필리핀,필리핀 마닐라 행복하다 추억 마닐라 곰돌이 애디 덕분 즐겁다 행복하다 만들다 주다 감사 드리다 여행 날수 있엇음 좋다 건강하다 자다 지내다 서울 반경희 2013년 2월 17 2월 21일 일정
필리핀,필리핀 세부 세부 세부 말로 듣다 신혼여행 결정 지로 경제 통해 여행 가다 크림슨 리조트 아름답다 조식 맛있다 묵다 정확 세부 섬옆 막탄 덥다 여행 바다 열대어 구경 스노클링 신나다 세부 바다 아름답다 바다 낚시 해보다 카지노 잃다 황제 스파 인상 야하다 필리핀 게이 예쁘다 마지막 쇼핑 문제 상품 설명 해주다 미안하다 5일 자다 오다 망고 산미구엘 맥주 먹다 여행사진 즐겁다 살다
필리핀,필리핀 세부 허니문 5일 후기 여행사 통해 작년 괌도 저렴하다 가다 기억 허니문 여지 결정 즐겁다 행복하다 세부 여행 여행 후유증 저렴하다 가격 알차다 구성 적당하다 휴식시간 딱좋다 리조트 스위트룸 크기 크다 수영장 한산하다 자유시간 맘껏 수영 놀다 좋다 저스틴 만나다 여행 내내 재밌다 성심 성의껏 열씨 밉다 노력 모습 감동 넘다 고맙다 한층 즐겁다 여행 담다 저스틴 짱짱 세부 여행 젤루 좋다 휴양지 허니 말다 황제 스파 마사지 이건 진짜 강추 온몸 녹다 결혼 준비 쌓이다 스트레스 피곤 풀리다 경비행기 가격 나가다 고민 허니문 이렇다 생전 경험 힘들다 선택 하늘 세부 모습 멋있다 감탄 절로 나오다 평생 잊다 허니 커플티 진주 귀걸이 과일 바구니 와인 케잌 덕분 허니문 기분 물씬 느끼다 찌다 허니문 보내다 해주다 저스틴 감사 드리다
필리핀,필리핀 세부 잊다 5일 허니문 5일 묵다 방이 하늘색 벽지 예쁘다 침대 편하다 조명도 좋다 첫날 도착 침대 플라워 장식 샴페인 초콜릿 놔두다 분위기 내다 맛있다 먹다 여기다 발코니 나가다 열다 사진 광경 좋다 발코니 내다 전경 발코니 내다 전경 예쁘다 잊다 가다 싶다 플랜테이션 베이 리조트 여기다 들어가다 스톤 마사지 받다 편하다 친철 좋다 마사지 추가 값어치 전반 신혼여행 만족 저렴하다 알차다 다녀오다 음식 자다 맞다 기본 포함 되어다 체험 즐겁다 해외여행 간다 꼭꼭 이용 싶다 드네 잊다 허니문 여행 만들다 고맙다
필리핀,필리핀 세부 여행 적극 추천 여자친구 처음 가게 해외여행 필리핀 세부 공항 처음 만나다 좋다 코랄 포인트 리조트 세부 설명 해주다 지루하다 재다 설명 해주다 역사 부분 세밀 숙소 체크 된거 확인 해주다 센스 일정 늦다 가깝다 거리 현지 뚫리다 자동차 멀다 거리 시원하다 봉고차 센스 운행 해주다 식사 손님 식사 시작 음식 부족하다 챙기다 앉다 식사 모습 감동 맥주 공짜 사주다 나이트 투어 아프다 동행 사주다 아프다 아프다 알다 프로 정신 도착 셋팅 되어다 추천 해주다 추가 상품 만족하다 패키지 여행 처음 만나다 즐겁다 여행 되어다 쇼핑 쇼핑 정보 완벽하다 해주다 마지막 아프다 자다 챙기다 미안하다 즐겁다 여행 세부 가다 적극 추천 드리다 참고 잘생기다 매너 좋다 낳다 좋다 여행 드릴 자다 부탁드리다 킹왕짱
필리핀,필리핀 막탄 여행 제니 추천 5일 일정 세부 막탄 여행 다녀오다 22일 출발 막탄 공항 저녁 늦다 도착 지인 걱정 멀리 제니 언니 따다 인사 들려오다 호텔 가다 친절하다 세심 일정 설명 해주다 처음 가다 여행 설레다 걱정 첫날 지나가다 합류 들다 성격 좋다 유머 심심하다 지나가다 개중 임신 니야 제니 꼼꼼하다 자다 챙기다 짧다 정속 고생 해주다 자다 챙기다 감사하다 여행 마닐라 보라카이 간다 언니 만나다 싶다
필리핀,필리핀 바비 완죤 땡큐 친정엄마 엄마 모시 필리핀 세부 여행 가다 오다 가다 문제 나이 들다 어른 계시다 걱정 되어다 바비 친절하다 일정 진행 해주다 즐겁다 좋다 추억 남다 오다 호핑 투어 엄마 멀미 멀미 약도 주시 춥다 하니 벗다 배려 보여주다 10 개국 다니다 만나다 많다 지식 정보 가지 자세하다 설명 해주시 갈다 바비 붙이다 그떄 뵈다
