country,cleaned_sentences
필리핀,특별하다 생생하다 보라카이 여행기 특별하다 생생하다 보라카이 여행기 5월 31일 오전 6시 00분 공항 리무진 버스 타고 인천공항 설레임 대감 잠도 한숨 못자다 기분 좋다 인천공항 도착 수속 세부퍼시픽 타고 떠나다 보라카이 새다 비행 잠들다 도착 해보다 벌써 필리핀 깔리다 공항 내다 내리다 모양 다행하다 도착 맑다 개다 수속 끝내다 깔리다 공항 나오다 만나다 보라카이 들어가다 버스 올라타다 버스 2시간 기분 좋다 깔리다 공항 인증샷 한장 보라카이 도착 진짜 여행 시작 보라카이 멋지다 리조트 그랜드 비스타 이틀 보내다 리조트 이쁘다 멀리 보이다 화이트 비치다 그림 들어오다 몰래카메라 찍히다 즐겁다 첫날 저녁 맛있다 삼겹살 된장찌개 저녁 먹다 보라카이 최대 쇼핑몰 보라카이 맛보다 야하다 망고 쥬스 사먹다 인증샷 첫날 무리하다 숙소 들어오다 뻗다 버리다 숙소 그랜드 비스타 아침 일찍 일어나다 그랜드 비스타 리조트 조식 먹다 화이트 비치 그림 화이트 비치 펼쳐지다 보라카이 바다 신나다 즐기다 티비 즐기다 고고 바나나보트 타고 낚시 제트 스키 타고 파라 셀링 멀리 보이다 운동 점심 먹다 파라 가든 식당 푸드 중식 스페셜 한지 하트 점심 맛있다 먹다 카트 버그 카를 즐기다 오다 우리나라 강촌 가평 즐기다 차원 다르다 신나다 화이트 비치 나오다 일링 보트 즐기다 멀리 보이다 석양 멋지다 구름 가다 아쉽다 링일 보트 저녁식사 몽골리안 맛있다 뷔페 음식 파라다이스 가든 호텔 조식 해변 화이트 비치 휴식 즐기다 멀리 아름답다 여자 걸어오다 정신차리다 보라카이 오다 해보다 야하다 스쿠버다이빙 교육 받다 보라카이 어메이징 간다 공연 배우 대기실 사진 기분 기분 멀리 이쁘다 오늘 아침 보라카이 상점 자세하다 둘러보다 서든 맥도날드 보이 스타벅스 유명하다 입구 망고 쥬스 맛있다 보라카이 오다 들다 보라카이 교통 수단 크다 부르다 탈때 마지막 추억 페인 티셔츠 어쩜 그리다 한국 즐겁다 여행 힘들다 여행 보라카이 브라이언 부장 일정 해주다 편하다 여행 말씀 재밌다 여행 배꼽 잡고 웃다 브라이언 부장 넘다 감사하다 최고 가다 보라카이 놀다 가다 가다 보라카이 이유 궁금하다 특별하다 생생하다 보라카이 여행기
필리핀,보라카이 윌슨 최악 비행기 내다 만나다 처음 인사 저가 여행사 여행 오다 마음 저가 오신 정표 나오다 내용 제일 마지막 내용 현지 상황 따르다 변경 문구 현지 사정 기분 옵션 추가 강요 윌슨 여행 옵션 전체 경비 주다 여행사 먹다 현지 도와주다 옵션 추가 일정 소개 내내 계속 마지막 기념품 가게 사면 좋다 추천 해주다 대부분 기념품 사지 저녁식사 자리 기분 나쁘다 윌슨 어렵다 내다 보라카이 행온 몹쓸 추억 만들다 거품 여행 타이틀 무색 윌슨 금전 마음 여유 만나다 대한항공 아시아나 항공 타고 좋다 리조트 예약 여행 만나다 옵션 싶다 추가 받다 해외여행 쉬다 힘드다 여행 출발 상담 여행 후기 평이 안좋다 질문 두다 걱정 걱정 현실 일어나다 좋다 만나다 행복하다 보내다 좋다
필리핀,보라카이 레오 감사 드리다 가족 보라카이 여행 세부 푸켓 사이판 휴양지 여행 별다르다 기대 가다 여행 일정 내내 날씨 좋다 입담 찍다 맛있다 먹거리 거리 귀가 즐겁다 여행 휴양지 달리 쇼핑 천연 자연환경 자체 리조트 해변 이자 번화가 편리하다 안전하다 밤늦다 아침 돌아다니다 기도 좋다 좋다 추억 만들다 해주다 감사 드리다
필리핀,보라카이 여행 후기 짧다 기간 다녀오다 만족스럽다 여행 여행가이드 친절 도도 만족스럽다 여행 즐거움 한결 더하다 만족스럽다 보라카이 가다 계획 노랗다 좋다 상품 해주다 감사하다
필리핀,보라카이 대가족 여행 매너 피터 안녕하다 5월 23일 명의 대가족 이끌다 보라카이 방문 김민정 워낙 꼼꼼하다 자다 챙기다 덕분 부모님 모시 즐겁다 추억 담다 오다 가다 힘들다 일정 내내 동행 해주다 피터 감동 어머님 기념 여행 마지막 저녁 파티 준비 해주다 주위 즐거움 어머님 감동 받다 감사하다 스킨 스쿠버 강사 감사 드리다 어머님께 연로 걱정 신다 계속 보호 해주다 어머님 스킨 스쿠버 제일 기억 남고 즐겁다 꾸벅 감사하다 제스퍼 고맙다 익살스럽다 표정 따뜻하다 미소 여행 내내 편안하다 다니다 덕분 돌아오다 깔리다 공항 수속 마치다 4일 챙기다 싶다 피터 제스 들다 고마 보라카이 추억 친절하다 들다 잊다 항상 사업 번창 건강하다
필리핀,보라카이 여행 15년 가족 해외 여행 기대 설레다 출발 보라카이 개인 해외 여행 자주 가보다 짜증 나다 크라운 컨벤션 투숙 나머지 일행 라카 멜라 투숙 일행 많다 포커싱 맞추다 진행 이해 비싸다 고도 라카 멜라 일행 맞추다 이동해 힘들다 일정 진행 배정 되어다 작다 부탁 알다 해결 패키지 여행 자유여행 이해 비싸다 들이다 누굴 이해 여행 회사 예약 받다 상황 설명 체크 아웃 비롯 체크아웃 들다 라카 멜라 래야 안좋다 상황 써다 회사 안녕하다 이용 주다 대단하다 감사하다 역할 관련 철저하다 교육 통해 통해 가시다 여행 인하다 불편 노력 고객 불편 드리다 사과 드리다 고객 즐겁다 여행 더욱 노력 이렇다 써다 보상 모르다 이렇다 성의 표면 써다 화나다 만들다 회사 사장 일반 고객 여행 부당하다 대우 받다 해봤다 뭐라다 궁금하다 써다 미안하다 회사 차다 이렇다 성의 대처 래야 찾다 여행사 광고 제일 무섭다 광고 권하다 본인 가다 여행 고객 필요하다 진행
필리핀,보라카이 5일 루이 감사하다 보라카이 5일 다녀오다 패키지 여행 처음 걱정 가다 루이 여행 내내 유쾌하다 재밌다 챙기다 개인 사정 옵션 선택 강요 여행객 편의 자다 챙기다 옆팀 들다 만나다 들다 부러워하다 보라카이 자체 이쁘다 티비 재밌다 알차다 여행 처음 들어가다 비행기 타고 버스 타고 배타 힘들다 다시다 오다 알다 아쉽다 가다 보라카이 진짜 진심 여행 내내 자다 챙기다 루이 감사하다
필리핀,보라카이 뜨다 나본 여행 무작정 기분 떠나다 보라카이 여행 30 13 04 13 걱정 대반 도착 깔리다 공항 처음 그날 스럽다 여행 마지막 자다 챙기다 감사 마닐라 보라카이 들어가다 넘다 걸리다 곧다 기다 여정 지치다 패키지 관강객 들다 유쾌하다 유머 풀다 주다 코드 맞다 필리핀 사다 들다 안되다 들다 소스 처가 재치 알다 보라카이 도착 첫날 이동 간다 보내다 차다 여정 시작 후기 관광객 지갑 열기 다니다 좋다 눈쌀 찌푸리다 짓거리 정해진 굵직하다 코스 움직 불필요하다 장소 안내 일정 항상 일찍 나오다 준비 해주다 관강객 의견 들어주다 패키지 일정 진행 최대한 적절하다 인내 조율 해주다 고생 많다 매일 필리핀 보내다 진심 느끼다 옳다 필요하다 얘기 해주다 희다 해주다 참고 자유롭다 돌아다니다 보내다 현지 친밀도 높다 코스 별로 오버 혜택 누리다 해주다 마지막 태반 마사지 좋다 남자 서다 태반 마사지 받다 주위 신경 꿋꿋 받다 마사지 받다 딥슬립 기왕 이면 마사지 태반 후회 가다 싶다 여행객 앓다 손수 끓이다 드리다 잔잔하다 얘기 들리다 차다 인간 만나다 좋다 여행 노엘 톤토 살라 맛포
필리핀,보라카이 좋다 뱃속 아기 해외여행 즐겁다 보라카이 만나다 심바 지다 자세하다 현지 설명 여러 도움 즐겁다 편하다 여행 좋다 추억 되어다 보라카이 여행 간단하다 요약 여행 만족하다 환전 달러 필히 동네 은행 인터넷 우대 쿠폰 방법 알아보다 인천공항 젠장 페소 환전 공항 좋다 말다 공항 보라카이 차이 나다 적당하다 환전 필요하다 환전 달러 페소 환전 페소 달러 환전 안되다 유의 항공사 세부퍼시픽 된장 이유 압니 호텔 크라운 컨벤션 차다 장도 좋다 한국인 만쿠 개인 음식 좋다 별로 음식 가리다 타입 로비 와이파이 자다 터지다 패키지 집사람 산모 여러가지 여행 좀더 다양하다 즐기다 싶다 호핑 좋다 바다 물고기 잡다 좋다 물고기 주다 좋다 보라카이 바다 깨끗하다 버그 전망대 가다 이효리 망고 찍다 푸카 비치 이동 전망대 시원하다 망고 쥬스 한잔 그늘 시원하다 바람 시원하다 정도 좋다 전망 감상 버티다 버리다 푸카 비치다 바다 깨끗하다 참고 깊다 무릎 들어가다 말다 빠지다 맛사지 마지막 여행 피로 풀다 맛사지 받다 오다 차다 좋다 버진 마트 필요하다 구입 참고 들다 몰다 먹거리 많다 가격 자다 들어가다 저렴하다 맛있다 먹다 바가지 쓰다 덥다 스타벅스 들어가다 알다 유일하다 에어컨 켜다 올라가다 에어컨 정면 자리 특석입니 커피 가격 한국 차이 물건 가격 비싸다 악세사리 사리다 버그 투어 선택 푸카 사다 몰다 반값 몰다 몰다 붙다 망고 망고스틴 추천 맛있다 망고 맛있다 딸리빠빠 우리나라 재래시장 영어 미숙 가격 흥정 잘못 사보다 보라카이 여행 심바 만나다 행운 보라카이 최고 친절 심바 한국인 지다 지다 현지 첫인상 무섭다 착하다 개인 저렴하다 패키지 오다 자유여행 계시다 저렴하다 가격 여행 오다 선택 관광 정도 매너 여행사 먹다 살다 마찰 생기 스케줄 어기 오신 힘들다 보라카이 워낙 작다 하루 반나절 패키지 즐기다 반나절 자유여행 충분하다
필리핀,보라카이 다녀오다 나서다 가족 부모님 캐나다 살다 언니 나오다 막내 가족 부모님 교향 이북 가족 외로워 3월 생신 엄마 4월 생신 아버님 3월 4월 해외 여행 정기 떠나다 올해 타이밍 놓치다 이용 여행사 연결 안되다 친구 소개 노랗다 이용 되어다 가격 저렴하다 불안하다 마음 출발 걱정 다르다 현지 따따 불편하다 부모님 밀착 관리 주시 편안하다 행복하다 여행 되어다 감사 드리다 애용 기쁘다 행복하다 여행 기대하다 관계자 감사하다
필리핀,오다 보라카이 여행기 여행 마지막 시작 감기 하필 이면 고장 에어컨 앉다 공항 오다 1시간 넘다 차디차다 에어컨 바람 맞다 에어컨 끄다 버스 습기 차오르다 운전 어려움 순간 순간 배려 몇번 해주다 감사하다 꾸벅 이틀 지나다 심해지다 감기 행복하다 여행기 넘어가다 여인 보라카이 여행기 거기 초딩 12 들다 떠들다 인내심 인지 되어다 짧다 순간 아가 비행기 리조트 만나다 절망 5일 다니다 절망 보라카이 밟다 순간 살다 어쩜 지나다 친해지다 좋아하다 예훈 가족 왼쪽 남자 차다 자다 생기다 좋아하다 예훈 한국 도착 이모 사진 찍다 싶다 눈물 글썽 헤어지다 싫어하다 녀석 귀엽다 귀엽다 이모 아침 예훈 수영 가르치다 고생 마냥 즐겁다 따르다 다니다 예훈 이모 즐겁다 젊다 젊다 예쁘다 파란색 점퍼 입다 에덴 별명 차다 많다 꼼꼼하다 자다 챙기다 많다 해주시 12 명의 초딩 질문 맞장구 치다 최고 최고 허다 오디 나오다 사이 챙기다 고생 많다 에덴 착하다 얌전하다 도도 코리안 레스토랑 마루 메뉴판 서다 사진 찍다 엉뚱하다 도도 웃기다 웃기 외치다 도도 얼굴 작다 안습 가다 찍다 보라카이 잊혀지다 현지 외침 이렇다 덴장 오다 하와 이안 피자 꽂히다 늘다 여행지 하와 이안 피자 외치다 덕분 찌다 필리핀 망고 보라카이 망고 쉐이크 유명하다 가게 마다 망고 쉐이크 천차만별 한화 000원 미만 망고 쉐이크 먹다 보라카이 스타벅스 망고식스 에덴 추천 해주다 옐로우 들다 맞다 옐로우 택배 요기 만나다 좋다 생기다 석양 우린 피자 한판 핫윙 4조 폭풍 흡입 생각나다 먹다 마지막 받다 스톤 마사지 완젼 최고 최고 요염 우린 긴장 놓다 우린 소중하다 가족 들다 마지막 여행사 즐겁다 갖다 해주다 감사 드리다 최고 보라카이 여행 찾다 이유 오다 알다 가다 싶다 보라카이 만나다 이쁘다 해변 잊다
필리핀,보라카이 파라다이스 가든 절대 비추다 22 26일 보라카이 파라다이스 가든 이용 후기 올려놓다 그림 좋다 사진 보라카이 메인 가든 맞다 숙소 체크 안내받다 가든 외부 동떨어지다 숙소 부족 호텔 인수 입구 파라다이스 가든 로비 버져시 호텔 붙다 어째 호텔 부가 깨끗하다 괜찮다 개미 빨갛다 개미 흰개미 항의 바꾸다 결론 파라다이스 메인 가든 숙소 동떨어지다 숙소 건물 변경 가능하다 여기다 중국인 영국인 우성 순위 또힌 여행 다녀오다 파라다이스 가든 항의 많다 들다 예약 받다 여행 비용 결코 작다 추가 현지 경비 포함 대기업 여행사 낳다 좋다 사진 고객 눈길 현혹 현지 고객 불편 대응 제로 이용 주변 절대 추천 입금 결재 연락 자다 후론 통화 어렵다 싸다 가격 예약 현지 가다 분명 후회 마케팅 최저 여행 절대 속지 말다 여행사 이용 권하다
필리핀,보라카이 여행 후기 15 개월 아들 데리 신랑 보라카이 5일 패키지 여행 다녀오다 아기 어리다 엄마 사하다 버겁다 체력 소유자 인지 출발 솔직하다 가다 고생 내리다 오다 걱정 자다 만난 덕분 즐겁다 여행 되어다 워낙 친절하다 자다 해주다 부부 도와주다 필리핀 현지 크다 신세 지다 아가 워낙 통통 아가 돌아다니다 에너자이저 아기 자다 돌보다 덕분 식사 다운 식사 옵션 편하다 사진 애가 아빠 삼촌 자다 따르다 지다 아빠 오라 고해 삼촌 떨어지다 정도 이분 도움 아들 래미 사하다 지치다 먹다 숙소 끄다 멜라 신관 깨끗하다 벌레 좋다 거기 직원 들다 아기 예쁘다 해주다 해외여행 라면 가보다 다니다 친절하다 따뜻하다 분위기 보지 필리핀 국민 80 카톨릭 신도 들다 예쁘다 마지막 재밌다 무료 데려가다 주다 사유 해변 예쁘다 깨끗하다 그날 거기 찍다 사진 제일 자다 나오다 정표 좋다 데려가다 감사 드리다 숙소 깨끗 직원 친절 최고 음식 정도 지식 나오다 나머지 한식 주다 멀미 짧다 고맙다 현지 차다 베테 싶다 인원 30 넘다 대규모 인원 이동 차다 소리 인원 체크 고가 가방 가지 다니다 버스 넣다 더러워지다 매다 다니다 손상 알다 자다 케어 주다 현지 팀웍 좋다 들다 아들 크다 데리 가다 들다 덕분 아기 낳다 처음 제일 편하다 되어다 고맙다 후기 읽다 필리핀 부부 고맙다 해주다 건강하다
필리핀,보라카이 5일 데릭 놓다 감사하다 여기저기 검색 해보다 가격 괜찮다 가게 되어다 처음 걱정 무섭다 만나다 좋다 추억 만들다 오다 친하다 언니 가다 가족 부부 솔직하다 가족 부부 여자 소외 받다 느낌 끄다 느낌 목적 가다 쫓기다 배려 해주다 싶다 요청 챙기다 코코 가스 가다 친철 데리다 자리 잡다 들어가다 일정 끝나다 감사 재밌다 지인 친구 고맙다 말론 데릭 즐겁다 덕분 좋다 보내다 감사하다 보라카이 가다 뵈다
필리핀,5일 보라카이 패키지 여행 후기 여행 예약 친구 아이디 폭풍 칭찬 해주다 파서 가입 남기다 패키지 맴버 좋다 편안하다 자다 보내다 유머 감각 차분하다 많다 일일 자다 답변 주시 데리 가다 들다 인터넷 찾아보다 가다 찾아보다 싶다 정도 말씀 해주시 프린트 해오다 나누다 패키지 티비 선택 이전 태국 여행 다녀오다 티비 장비 허다 모든 장비 좋다 고장 나다 싶다 바꾸다 감사하다 가다 친구 아프다 필요하다 가지 숙소 찾아오다 덕분 편안하다 자다 보내다 가다 필리핀 아쉽다 미국여행 갈껀 다르다 뵙다 싶다
필리핀,준준 보라카이 그랜드 비스타 5일 여행 2월 19일 23일 보라카이 그랜드 비스타 빌라 준준 패키지 여행 다녀오다 가족 여행기 솔직하다 숙소 빌라 기대 휴양지 여행 다니다 지라 여행지 빌라 비교 빌라 베란다 개인 목욕탕 놓다 느낌 숙소 숙소 자체 실망 부분 닐님 옵션 강요 그다지 편안하다 일정 진행 자유시간 주시 필리핀 역사 재미 해주다 자유여행 기분 들다 유쾌하다 패키지 여행 고맙다 마음 담기다 여행기 남기다 여행 항상 역량 굉장하다 중요하다 가족 항상 복은 여행 일정 일링 보트 좋다 스킨 스쿠버 재미 보라카이 모든 길다 몰다 연결 몰다 화이트 비치다 일정 내내 들리다 선택 관광 아들 녀석 스킨 스쿠버 다이빙 워낙 아들 다이빙 제일 재미 패키지 여행 몇번 다니다 항상 숙소 실망 주다 들이다 차다 좋다 신다 대체로 만족하다 즐겁다 여행 사진 많다 개인 블로그 자세하다 적다 후기 참고 놀다 오시 마지막 블로그 주소 남다 가다 닐님 준준 수고 많다 기회 만나다 기대하다 741
필리핀,보라카이 여행 5일 보라카이 여행 5일 덕분 즐겁다 여행 감사하다 처음 가보다 필리핀 보라카이 좋다 헬퍼 덕분 즐겁다 보내다 여행 내내 좋다 믿음직하다 여행 내내 인도 해주다 친구 좋다 보내다 기쁘다 장님 최고
필리핀,보라카이 심바 토토 5일 행복하다 2월 17일 5일 필리핀 항공 저녁 출발 친구 패키지 여행 처음 해보다 걱정 앞서다 공항 내리다 반갑다 맞이 주시 덕분 즐겁다 지내다 돌아오다 가르치다 주다 재미 주다 느끼다 보라 피곤하다 넘치다 에너지 신경 써주다 모습 감동 감사하다 어떻다 표현 모르다 건강하다 행복하다 놀다 갈다
필리핀,보라카이 풍경 멋지다 감사 필리핀 사랑 덕분 멋지다 5일 보내다 일인 미각 촉각 후각 청각 모든 감각 만족 편안 흥분 나다 배부르다 여행 섬세하다 챙기다 만들다 주신 여행 받아들이다 마음 준비 마음 알아주다 훌륭하다 좋다 여행 돌아오다 비행기 좋다 여행 만들다 감사 드리다 중요하다 알다 섬세하다 만나다
필리핀,보라카이 심바 토토 최고 안녕하다 2월 17일 출발 2월 21일 돌아오다 패키지 다녀오다 친구 후기 남다 싶다 회원 가입 실컷 자고 칭찬 첫날 가다 뭐라다 해주다 고생 긍정 에너지 좋다 솔직하다 걱정 가다 돌아오다 싫다 날씨 좋다 아쉽다 덕분 드리다 가다 고맙다
필리핀,처음 가보다 보라카이 메스 가보다 보라카이 오색 빛깔 바다 최고 이구 해질녁 석양 아름답다 여러 가지 체험 좋다 오다 휴양지 여유 로움 멋지다 빡빡 상속 벗어나다 마음 여유도 찾다 참으로 멋지다 여행 낯선 되어다 메스 덕분 편안하다 재다 구석구석 구경 느끼다 자리 빌어 메스 고마움 전함 들어오다 보라카이 상품 가다 고프다
필리핀,최악 보라카이 플레인 추가 남자친구 보라카이 패키 기지 저렴하다 고해 이용 되어다 남자친구 이용 여행 다니다 기도 최악 처음 보라카이 착하다 덥다 주다 좋다 신분 가면 갈수록 최악 약속 지키다 약속 지키다 거짓말 최고 안되다 말로 거짓말 1시간 덥다 날다 기다리다 일정 바꾸다 패기 지다 포함 되어다 상품 빼기 패키지 체험 다이빙 말씀 3일 물어 스킨 스쿠버 옵션 선택 120달러 내다 스킨 스쿠버 옵션 할껀 물어 보더 커플 얘기 들다 물어보다 답변 해주다 체험 다이빙 패키지 버리다 패키지 상품 지불 상태 되어다 버리다 스파 가격 마사지 받다 물어보다 커플 보라 스파 마사지 받다 얘기 더니 예약 해주다 50달러 마사지 100달러 20달러 추가 더니 싸우다 100달러 옵션 강요 분명하다 옵션 선택 인걸 알다 옵션 선택 패널 내야 얘기 50달러 커플 늘다 옵션 매너 얘기 그다음 커플 늘다 커플 옵션 당연하다 얘기 갑작스럽다 일정 변경 아침 9시 호핑 투어 저녁식사 일몰 일링 보트 호핑 투어 출발 합치다 가야 12시 변경 말다 까먹다 늘다 아침 8시 30분 호핑투어 나가다 셧다 호핑 투어 배다 12시 이서 타고 나가다 그리다 호핑 투어 끝나다 햇볕 뜨겁다 일링 보트 준비 안해 나가다 난감하다 결론 커플 모이다 자리 절대 일정 얘기 해주다 일정설 해주다 커플 일정 얘기 옵션 얘기 내면 내다 3일 아침 관광객 언성 높이다 싸우다 버려지다 화가 늘다 가다 틀리다 가다 틀리다 헬퍼 요구 40달러 60달러 써다 기분 나쁘다 먹다 오다 내야 요구 좋다 이드 커플 이모 먹다 경우 다시다 노랗다 패키지 상품 이용 찌다 얘기 싸다 비지 차다 황당하다 어이없다 일도 쓰다
필리핀,보라카이 훈남 스티브 5일 보라카이 일정 다녀오다 좋다 날씨 흐리다 퍼펙트 아쉽다 현지 한국 현지 덕분 즐겁다 여행 덕분 부부 즐겁다 보내다 감사하다
필리핀,보라카이 칭찬 지난해 12월 17일 인천 출발 보라카이 5일 패키지 다녀오다 일행 기억 패키지 여행 최고 여행자 배려 마음 깊다 안내 즐겁다 자다 해주다 저가 여행 덕분 풍요 여행 되어다 칭찬 띄우다 일부러 회원 가입 새해 받다
필리핀,보라카이 5일 팀원 즐겁다 감사하다 원래 상품 자다 쓰다 남기다 부모님 모시 다녀오다 부모님 계시다 자유여행 패키지 선택 사람과 다르다 부모님 모시 가다 마음 편하다 다녀오다 크다 목표 상품 끄다 멜라 전화 그랜드 보라카이 변경 회사 사정 크라운 리젠시 1일 그랜드 비스타 2일 바뀌다 결론 좋다 숙소 좋다 좋다 솔직하다 넉넉하다 소비 마찰 생기다 신경 써다 주다 부모님 즐겁다 추억 만들다 오다 아버님 장애 고민 신경 써주다 덕분 재미있다 스킨 스쿠버 다이빙 멀미 패러세일링 호핑 투어 재미있다 소규모 14 부모님 어머니 어머니 챙기다 팀원 더욱 고맙다 즐겁다 부모님 모시 갈다 기회 멋지다 추억 남다 싶다 그땐 한잔 여유 되어다 실제 부모님 챙기다 여행 여유 즐겁다 추억 좋다 기억 가다 팀원 추다 한국 날씨 적응 자다 자다 기원
필리핀,보라카이 윌슨 저렴하다 이용 되어다 좋다 땡큐 고요 윌슨 오다 빵빵 경력 꼼꼼하다 스케줄 많다 인원 지인 헬퍼 토니 또또 좋다 들이다 돌아오다 공항 장난 훌쩍 가기 싫다 또올거랬더 투모로우 오랬던 바짝 벌다 갈다 여자 이서 가다 걱정 다니다 안전하다 다니다 도움 주다 감사하다 숙소 관광 전체 들다 서비스 좋다 워낙 좋다 보라카이 위험하다 호객 따라가다 업그레이드 마사지 잠들다 만족 전신 마사지 들어서다 듬뿍 쥐다 조식 못먹엇어 워낙 많다 사먹다 들다 깔끔하다 차다 망고 다가 식당 자르다 달라 이뿌다 자르다 주시 기회 가다 싶다 재밌다 보내다 해주다 여행사 땡큐 전하 싶다 한국 오시 진심 드리다 신경 써주다 감샤합니 많다 사진 릴게 개인 소장 싶다 수고
필리핀,13년 보라카이 13년 신혼여행 보라카이 가다 가다 절정 시절 달러 치쏫 가다 아름답다 개발 매력 보라카이 많다 시설 대화 되어다 해변 옛날 나다 좋다 편안하다 여행 도와주다 현지 김경민 좋다
필리핀,보라카이 파라다이스 가든 다녀오다 신혼여행 보라카이 재미나 다녀오다 숙소 파라다이스 가든 깨끗하다 숙소 가든 들다 작다 도마뱀 라이 크다 알아듣다 친절하다 현지 보조 친절하다 보라카이 특별하다 해양스포츠 말다 즐기다 버기카 타고 관광 진짜 재밌다 여행 내내 식당 입맛 자다 맞다 데려가다 주시 보조 사진 찍다 들어주다 진짜 편하다 누리 오다
