country,cleaned_sentences
서유럽,서유럽 엄마 유럽 여행 입사 엄마 단둘 유럽 여행 가다 싶다 급하다 패키지 여행 찾아보다 취업 길다 여행 일정 빼기 어렵다 서유럽 여행 가다 싶다 마침 서유럽 유럽 여행 자리 남다 되어다 일주일 신청 되어다 급하다 일정 패키지 선택 빡빡 일정 걱정 많다 정해진 일정 맞추다 편하다 갈다 중간 여러 변수 힘드다 점도 기억 지나다 나다 웃다 추억 코로나 맡다 일정 힘들다 김대호 인솔 처음 32 문제 자다 인솔 해주다 안전하다 여행 다녀오다 감사 드리다 출국 2022 06 22 17시간 비행 걱정 마음 크다 코로나 출국 설레다 마음 출발 카타르항공 처음 좌석 나름 넓다 기내식 괜찮다 프랑스 파리 2022 06 22 06 23 여행 가기 유럽 날씨 오다 흐리다 다행하다 날씨 좋다 설레다 여행 시작 날씨 요정 많다 덕분 여행 내내 날씨 좋다 기다 비행 현지 투어 시작 솔직하다 피곤하다 힘들다 센느강 유람선 타고 석양 지다 파리 야경 피로 녹다 사라지다 예쁘다 엄마 힘들다 오기 스위스 뮈렌 2022 06 24 스위스 하루 짧다 일정 구름 끼다 아쉽다 웅장 멋있다 여행 다니다 항상 100 만족하다 어렵다 이렇다 아쉬움 남아 여행 가게 들다 기회 스위스 가다 싶다 유럽 가면 어머니 납작 복숭아 먹다 싶다 마침 가게 팔고 먹다 맛있다 패키지 여행 버스 타고 길다 풍경 구경 인솔 틀어주다 노래 들다 가다 지루하다 진짜 라디오 들다 가다 감성 충전 호강 여행 이탈리아 밀라노 베로나 베네치아 피렌체 오르비에토 로마 2022 06 25 06 28 이탈리아 많다 보내다 많다 좋다 건축물 아름답다 중간 중간 소소하다 구경 거리 많다 힐링 여행 베네치아 수상 택시 설명 듣다 시원하다 바람 쐬다 스트레스 해소 자유여행 중간 커피 젤라또 간식 거리 사먹다 매일 젤라또 사먹다 충전 즐겁다 보내다 오르비에토 작다 마켓 마을 골목 골목 둘러보다 소소하다 재미 느끼다 마지막 로마 배다 투어 되어다 덥다 날씨 쾌적하다 구경 좋다 로마 유적지 핵심 부분 빠르다 사진 자유시간 충분하다 덥다 날씨 힘들다 이탈리아 오다 에스프레소 먹다 배우다 설탕 들어가다 맛있다 이탈리아 커피 잊다 로마 김소영 꼼꼼하다 설명 해주시 자다 인솔 해주다 덕분 편하다 자다 다녀오다 모르다 어머니 서도 좋다 감사글 남다 싶다 감사 드리다 솔직하다 기억 남지 예쁘다 풍경 정도 로만 보이다 직접 자료 준비 해주다 차근차근 설명 해주다 진짜 감동 덕분 서유럽 여행 로마 좋다 추억 입국 2022 06 28 06 29 마지막 공항 가다 화창하다 날씨 떄문 가다 길이 아쉽다 느껴지다 여행 네박자 중요하다 말씀 여행 김대호 인솔 기사 팀원 날씨 자다 맞다 무사하다 자다 다녀오다 김대호 인솔 작다 선물 사진 선물 해주다 마지막 좋다 추억 남기다 감사 드리다 솔직하다 8일 서유럽 여행 짧다 많다 배우다 느끼다 소중하다 엄마 둘이서 좋다 추억 만들다 감사 드리다
서유럽,심쿵 심쿵 서유럽 개국 10일 다녀오다 국어 능통하다 역사 지식 풍부하다 노련하다 노병 추다 인솔 폼페이 로마 피렌체 메디치 미켈란젤로 넘다 넘다 재미있다 해주다 인수 로마 현지 귀엽다 유머러스하다 레오 베네치아 친절하다 순발력 강승범 파리 목소리 좋다 젠틀 홍성빈 런던 덕분 서유럽 개국 10일 여행 행복하다 다녀오다 한겨울 서유럽 여행 망설이다 다행하다 스물 세분 일행 쌓다 날씨 천사 가다 덕분 한겨울 가다 기적처럼 햇빛 넘다 넘다 좋다 하늘 예쁘다 따뜻하다 10일 일정 빡빡 강행 심쿵 심쿵 가슴 행복하다 식사 보통 수준 먹다 숙소 보통 수준 나쁘다 마지막 파리 호텔 조식 먹다 크라상 최고 먹다 싶다 선택 관광 400유로 부담스럽다 선택 경험 선택 필수 놓치다 말다 후회 알다 서유럽 여행 가시다 돼지 어댑터 욕실 슬리퍼 접다 휴대 커피 포트 컵라면 볶다 김치 준비 좋다 이탈리아 내내 스파게티 먹다 볶다 김치 고추장 곁들이다 먹다 먹다 컵라면 챙기다 커피 포트 챙기다 줄곧 먹다 일행 빌리다 여행 7일 컵라면 먹다 눈물 챙기다
서유럽,임노 장님 서유럽 여행 여행 바쁘다 흘러가다 휩쓸다 살아가다 현대인 지치다 마음 새롭다 재충 전시 켜다 서로 익숙 가다 통해 2019년 12월 30일 2020년 1월 10일 서유럽 개국 12일 여행 서유럽 계획 인접 아프리카 에볼라 바이러스 창궐 바람 취소 유럽 다녀오다 가다 설레다 햇수 따다 걸치다 여행 깊다 오다 마음 떠나다 마음속 대감 크다 서유럽 가게 되어다 마음 편하다 옵션 마음 쓰다 되어다 망설이다 아예 처음 노팁 옵션 선택 마음 편하다 사전 항공 좌석 예약 되어다 불안하다 인지 좌석 만석 대한항공 답변 일찍 인천공항 도착 리무진 타고 가다 자리 받다 정도 타이트 여행 시작 여행 구성원 31 임노 안내 되어다 바티칸 시티 가게 구성원 캐톨릭 신자 상당수 되어다 비행기 타고 로마 레오나르도 다빈치 공항 내다 로마 호텔 숙박 실망 분도 계시다 유럽 의례 마음 편하다 로마 유명하다 시작 교황 나라 바티칸 시티 로마 관광 코스 들다 쏘렌토 나폴리 피렌체 베니스 밀라노 코모 호수 거치다 여행 방점 스위스 푸르다 젊다 여인 봉우리 가기 산악 열차 타고 올라가다 베른 거치다 타고 프랑스 파리 가다 파리 루브르 박물관 베르사이유 궁전 개선문 유명하다 샹젤리제 멋지다 야경 거리 직접 오다 후회 유로스타 타고 영국 입국 옥스퍼드 대학 웨스트민스터 사원 관광 서유럽 여행 마침표 찍다 여행 떠나다 자의 마음 다짐 중요하다 가다 구성원 중요하다 이끌다 인솔 자세 여행 구성원 대하 마음 여행 피곤하다 여정 기쁘다 편안하다 주다 여행 어떻다 여행 코스 인솔 망치다 경우 이끌다 서유럽 여행 임노 장님 재치 말솜씨 발생 여행 불편하다 불쾌하다 능숙하다 대처 여행 구성원 서로 세대 오다 서먹하다 들이다 재치 말로 때로는 세대 아우르다 마음 오다 닿다 말로 여행객 이끌다 여행 나서다 쓰다 여행 후기 두서 써다 임노 장님 감사 말씀 드리다 여행 마다 느낌 다르다 여행 경우 생기 여행 싶다 장님 통해 서유럽 여행 늘다 여행 크다 보람 각기 성격 많다 오다 여행 여느 경우 다르다 되어다 경북 포항 어머니 오신 따님 처음 세상 예쁘다 착하다 예의 바르다 마음씨 곱다 분도 존재 구나 되어다 여행 하루하루 지나다 포항 따님 보여주다 태도 느껴지다 착하다 곱다 마음씨 지치다 피곤하다 여행 기분 새롭다 해주다 불다 버스 가득 실리다 트렁크 꺼내다 멍하니 서다 트렁크 들어오다 꺼내다 주다 마음씨 내다 좋다 마음 들다 항상 웃다 모습 대하 모습 집의 귀엽다 따님 따다 좋다 마음 가득 남다 이름 모르다 연락처 모르다 헤어지다 오다 아쉽다 열흘 넘다 피곤하다 여행 항상 새롭다 기분 시작 불다 좋다 직장 들어가다 소식 듣다 싶다 연락 받다 안타깝다 좋다 소식 마음 빌어 괜찮다 이메일 좋다 소식 해주다 궁금하다 서유럽 여행 통해 들다 많다 세대 구성원 원만하다 이끌다 주신 임노 장님 항상 밝다 모습 친절 보이다 주신 경북 포항 오신 모녀 감사 드리다
서유럽,서유럽 여행 타고 자다 다녀오다 서유럽 여행기 금년 맞다 집사람 아들 내외 마련 해주다 서유럽 패키지 여행 2019 12 01 12 09 다녀오다 장시간 비행기 여행 싫어하다 별로 갈다 두다 순이 잡다 가다 오자 12 01 신도림역 지하철 타고 홍대역 공항철도 갈아타다 인천공항 터미널 도착 인솔 만나다 애송이 죄송 어눌하다 말솜씨 싶다 여행 자다 다녀오다 걱정 앞서다 수신기 예약 와이파이 도시락 받다 아들 아시아나 항공 가다 출국 빠져나가다 면세점 돌아보다 되어다 항공기 탑승 12시간 기다 비행 로마 도착 인솔 중심 일행 집합 21 제일 연장 로마 변두리 호텔 자고 아침 조식 식당 가다 입맛 맞다 음식 시작 음식 고생 걱정 시작 어쨌든 식사 바티칸 가다 서서 기다리다 두번째 투어 시작 되어다 현지 훌륭하다 유머 감각 굳다 마음 리기 시작 웅장 장엄하다 바티칸 성당 박물관 돌아보다 감탄 찬사 절로 나오다 인솔 어눌하다 센스 안내 멘트 오다 이건 처음 애송이 가다 코메디언 표정 변하다 은근 일행 마음 열다 장거리 투어 기다 시원찮다 배정 전의 선입관 가다 시작 로마 투어 세번 베스 오스 화산 폭발 순식간 잿더미 폼페이 유적 돌다 자연 인간 나약하다 모습 비극 많다 소렌토 나폴리 해변 숙소 오다 4일 피렌체 베니스 투어 웅장 피렌체 성당 사진 찍다 자다 생기다 외모 젊은이 스마트폰 사진 찍다 달라 오케이 사진 찍다 각도 맞추다 쪼그리다 자세 취하 젊다 친구 자꾸 일으키다 세우다 하라 주문 자세 안나 쪼그리다 일으키다 세우다 자세 바로잡다 기르다 되어다 땡큐 가버리다 순간 앗차 메다 작다 가방 자크 군데 열리다 인솔 안내 사진 찍다 달라 절대로 안되다 여기다 선생 천지 생각나다 차다 바보 면서 가방 다행하다 없어지다 물건 다행하다 가방 자크 여권 주머니 들다 지갑 앞쪽 작다 주머니 넣다 친구 크다 주머니 자세 바로잡다 기르다 헛수 진짜 조심하다 5일 수상 도시 베니스 밀라노 투어 국내 베니스 수위 높다 통제 뉴스 갈다 걱정 날씨 좋다 곤돌라 수상택시 모처럼 산뜻하다 일정 6일 밀라노 숙박 스위스 인터라켄 이동 산악 차로 해발 454 융프라우 관광 멋지다 경관 감탄사 연발 멋지다 관광 어렵다 공사 완성 스위스 기술 인간 노력 숙연 고소 산소 부족 어지럽다 쓰러지다 노력 7일 프랑스 파리 이동 원래 계획 벨포르 차로 이동 계획 프랑스 연금 개혁 반대 전면 파업 열차 운행 중단 바람 인터라켄 새벽 1시 기상 9시간 버스 타고 파리 리옹 도착 세련되다 멋지다 현지 덕분 파리 여행 감동 에펠탑 센느강 유람선 르르 사유 궁전 루브르 박물관 파리 유명하다 알다 8일 프랑스 예술가 즐기다 찾다 몽마 르뜨 언덕 성당 단체 사진 찍다 성당 들어가다 기도 드리다 여행 마지막 일행 친하다 되어다 중식 한식 먹다 마지막 브렝땅 백화점 도착 세계 패션 쇼핑 일정 마무리 귀국 항공권 스마트폰 예약 일행 좌석 제각각 인솔 자도 걱정 크다 내일 공항 일찍 가다 상황 알아보다 9일 일행 항공권 좌석 제각각 일찍 공항 가다 약국 들르다 에펠탑 보이다 사진 찍다 계략 넘다 가면 마지막 일정 소화 공항 도착 좌석 배정 요구 직원 흔쾌하다 들어주다 집사람 9시간 생이별 고통 해결 해주다 여행 인솔 어눌하다 성실하다 모습 감사하다 한편 인솔 직업 차다 어렵다 직업 리아 알다 나라 역사 문화 사회 제도 풍습 확실하다 마스터 중강 중간 슬기롭다 넘어가다 센스 팔방미인 되어다 인솔 현지 들다 세분 훌륭하다 성실하다 인간 자다 해주다 감사하다 여행 마련 해주다 아들 내외 고마움 전하 집사람 가족 분위기 화애롭 여행 마치다 일행 감사하다 여행 이용 무궁 발전 기원 서유럽 여행 후기 마치다 감사하다 2019 12 11 신영 올리다 중간 사진 넣다 자다 안되다 올리다 양해 바라다
서유럽,20 대다 인생 해외 여행기 서유럽 미란 인솔 해외 여행 이렇다 좋다 전혀 기대 낮다 전혀 여행 진짜 좋다 23 번의 해외 여행 경험 계획 부모님 권유 크다 먹다 제일 저렴하다 많다 돌다 결제 스페인 포르투칼 모로코 12일 저렴하다 가격 139만원 일주일 여권 신청 싸다 출발 주변 가격 가격 인지 기대 전혀 이정 가격 이면 노숙 가다 첫째 새벽 일어나다 버스 타고 인천공항 이쁘다 미란 인솔 만나다 두근거리다 마음 핀란드 비행사 핀에어 자리다 다르다 좁다 딱하다 불만 가지다 정도 좋다 비행기 대부분 음식 공짜 서비스 좋다 의자 비치 되어다 테블릿 최신 영화 음악 게임 비행기 카메라 가능하다 승무원 아름답다 멋지다 상당하다 많다 기분 좋다 단점 기압 의하다 귀가 아프다 좋다 사진 도착 이쁘다 모든 건물 조형 물들다 바둑판 모양 이쁘다 배열 되어다 도시 아름답다 만들다 비행기 하루 보내다 헬싱키 도착 친절하다 꼼꼼하다 미란 인솔 덕분 자다 오다 거기 비행기 스페인 바르셀로나 안전하다 가다 바르셀로나 호텔 들어가다 외로 괜찮다 깔끔하다 아늑하다 오다 에이트 걱정 다행 자다 맞다 별일 둘째 아침 일찍이 일어나다 먹다 해외 아침 저녁 식당 대부분 닫다 호텔 먹다 오다 래서 북적 북적 음식 여러가지 종류 뷔페 나오다 괜찮다 먹다 먹다 거부 상태 일정 람블 라스 거리 올림픽경기장 몬쥬 언덕 가족 성당 공원 몬세라트 빡빡 일정 짧다 많다 효율 벌다 좋다 여행지 진짜 감탄 나오다 정도 마음 들다 재치 유익하다 설명 이러하다 여행지 자다 이해 느끼다 자다 놀다 호텔 오다 경악 그림 숙소 호텔 가운데 수영장 이쁘다 카페 놓이다 수많다 하늘 의자 침대 거기 나가다 우리나라 부산 크다 모래 비단 해변 오늘 힘들다 가다 자유시간 가야 호텔 휴식 나가다 해변 가다 야경 바라보다 근처 햄버거 문집 햄버거 먹다 도시 저녁 떄문 아름답다 풍경 즐기다 오늘 그라나다 알함브라 궁전 가다 일정 단연 최고 알함브라 궁전 외부 야경 여러가지 모습 가지 알함브라 궁전 시간대 별로 여러가지 아름답다 가지 내부 아름답다 외부 막히다 그라나다 도시 내부 이쁘다 그라나다 만들어지다 맥주 막히다 딱딱하다 맥주 보드카 올라오다 금방 취할 넷째 가다 시기 우기다 거짓 좋다 많다 오늘 론다 누에 해변 휴양지 가다 장관 영화 절벽 끼리 이어지다 크다 다리 감히 지중해 맘마미아 나오다 아름답다 해변 째다 오늘 모로코 가다 나다 알다 이슬람 문화 테러 들려오다 여러 솔직하다 위험하다 가다 이해 가지 아프리카 알다 신청 막상 가보다 모로코 수도 라바트 카사블랑카 유럽 다르다 아름답다 아랍 남자 범접 덩치 여성 아름답다 미모 여러가지 괜찮다 단점 숙소 외관 괜찮다 내부 우리나라 시골 모텔 저녁 돌아다니다 위험하다 정도 치안 여러 든든하다 현지 앞뒤 양옆 두르다 싸다 째다 카사블랑카 페스 탕헤르 사원 여러가지 물품 만들다 수제 공장 가다 기억 남다 탕헤르 북적 거리 풍경 항구 도시 저녁 야경 좋다 대부분 카페 많다 이슬람 문화 지정 장소 판매 안해 여기저기 찾다 양주 팔다 가다 가격 저렴하다 우리나라 40 프로 저렴하다 싶다 무섭다 많다 돌아다니다 지역 경찰 군인 무섭다 개인 행동 남자 추천 모로코 짚다 가야 째다 상당하다 위험하다 주의 항만 자다 지키다 괜찮다 째다 우리나라 70년 모습 우리나라 형식 아름답다 모습 가지다 나라 째다 상당하다 멋있다 아름답다 째다 세비야 대성당 스페인 광장 가다 설명 필요 짜다 투어 순간 연예인 투어 좋다 버리다 스페인 광장 대성당 좋다 째다 포르투칼 가다 둘러보다 제일 아름답다 거기 풍경 장관 장관 끄다 끄다 아름답다 풍경 눈물 지경 째다 디즈니 성의 모티브 세고비아 아쉽다 날씨 좋다 우기 이해 이쁘다 째다 마지막 마드리드 보내다 여러 성당 도시 관람 사진 찍다 설명 세도 모자라다 정도 많다 느끼다 달다 많다 공부 되어다 여러 체험 비싸다 비싸다 해보다 의미 체험 보이다 여러가지 장점 평소 한국 걷다 걷다 느껴지다 여행지 웃다 가득하다 12일 여행 투어 예상 다르다 성적 좋다 진심 행복하다 좋다 들다 마지막 들다 가족 느껴지다 많다 유럽 여행지 많다 성당 끼다 모든 성당 전혀 모양 아름답다 갖추다 좋다 무교 여행 무사하다 마치다 해달라다 기도 실제 무사하다 마치다 다사 다난하다 많다 세다 싶다 안타깝다 따름 여러 에피소드 구두 셔츠 두다 오다 귀국 길다 잃어버리다 아름답다 여행지 착하다 팀원 들다 행운 날씨 박자 고루 갖추다 여행 해외 여행 마무리 되어다 오다 거리 슬프다 정도 행복 자체 여행 돌다 쓰다 돌아가다 좋다 마음 여행 무사하다 해주다 미란 인솔 장님 감사 드리다 자다 써다 읽다 불편하다 죄송하다 읽다 감사 드리다
서유럽,서유럽 여행 11월 서유럽 우기 걱정 되어다 크다 걱정 행복하다 여행 베테 김진영 센스 재치 일정 안내 넘다 좋다 김진영 친절하다 여리다 반전 삼손 떠나다
서유럽,베스트 막히다 김우정 오다 서유럽 12일 부부 아들 서유럽 여행 다녀오다 2019 11 04 2019 11 15 대한항공 이용 몇번 이용 인솔 여행 처음 출국 현지 만나다 일정하다 여행 대부분 서유럽 개국 이동 여정 인솔 역할 크다 현지 일정 진행 항상 인원 체크 소매치기 단속 사슴 크다 안전하다 이끌다 융프라우 등반 고산병 증세 어리다 학생 부축 업다 이동 든든하다 여행 친구 일정 버스 장거리 이동 일정 쇼핑 절차 구매 노하우 알다 효과 일정 대응 실속 여행 숙소 식사 부족하다 느끼다 부분 서도 여행 묘미 느끼다 설명 자다 주심 무난 행사 진행 해주다 숙소 배정 받다 나서다 로비 일정 대기 모르다 컨디션 대응 해주다 개인 항공권 가격 저렴하다 가격 자다 다녀오다 일부 숙소 부분 부족하다 부족하다 나름 가격 크다 문제 가다 부분 인솔 선생님 자다 풀다 여행 중간 중간 자유시간 가짐 자유여행 분위기 나름 느끼다 현지 인솔 미도 자다 맞다 즐겁다 보내다 한편 아침 파리 영국 넘어가다 유로스타 탈때 새벽 나가야 현지 버스 기사 추가 비용 언급 곤란하다 자다 대응 넘다 면세 물품 곤란하다 상황 유연하다 자다 대처 해주다 인솔 경험 대응 중요하다 새삼 깨닫다 되어다 여행 상품 어떻다 일정 짜다 행사 진행 중요하다 훌륭하다 인솔 보유 롱런 합리 가격 실속 여행 기준 다르다 엄밀하다 현지 플레인 사항 여행 인솔 알차다 일정 운영 즐겁다 해주다 마음 움직이다 부족하다 식사 기대 숙소 부정 갖다 아름답다 자연 경관 자리 좋다 인연 통해 아름답다 관광 마음 풀다 인솔 많다 업무 싶다 여행사진 올리다 진일 차이점 음식 숙소 사진 공유 해드리다 중간 중간 한식 음식 적응 크다 문제 중간 중간 무제한 먹다 중식 타임 인솔 미리 오다 고추장 가지 말씀 해주다 준비 갈다 든든하다 먹다 지식 먹다 라자냐 느끼하다 맛있다 먹다 중식 타임 일행 멸치 볶음 고추장 주다 간만 먹다 맵다 고추장 막히다 호텔 조식 일반 씨리얼 대부분 일행 나오다 조식 들다 부실하다 느껴지다 아침 햇반 하니 들다 기도 인터라켄 융프라우 내려오다 먹다 꼬리곰탕 인솔 막히다 국물 싹싹 비우다 프랑스 먹다 달팽이 요리 처음 먹다 요리 이기다 맛있다 먹다 프랑스 숙소 기대하다 희다 잘만 파리 한국 식사 김치찌개 나다 게눈 감추다 먹다 파리 육개장 한인식 들이다 파리 호텔 아침 조식 파란 사과 맛있다 영국 들리다 한국 식당 외국인 오다 들다 공기밥 주시 좋다 영국 숙소 히드로 공항 가깝다 소음 컨디션 좋다 영국 호텔 조식 미국 조식 유럽 조식 씨리얼 영국 호텔 감자 고로케 종류 다양하다 영국 마지막 식사 홍콩 중국 음식점 음식 가짓수 많다 푸다 지다 자다 먹다 여행 내내 휴대폰 기행문 작성 바쁘다 개인 사진 음식 사진 일부 숙소 사진 위주 작성 해보다 일정 내내 인솔 말씀 자다 따르다 일행 감사 드리다 사고 자다 마치다 인솔 착하다 일행 건강하다 좋다 기회 뵙다 희망 번창
서유럽,모든 좋다 서유럽 통해 서유럽 가다 지다 2년 올리다 후기 올리다 코너 알다 진작 올리다 서유럽 서유럽 모든 좋다 인솔 이탈리아 현지 최영 최영 입담 웬만하다 개그맨 저리 가르다 착착 노련 밉다 넘치다 좋다 날씨 친절하다 관계자 덕분 평생 잊다 여행
서유럽,인생 서유럽 여행 우여곡절 예매 9일 서유럽 여행 무사하다 마치다 도와주다 신상진 인솔 이탈리아 재미있다 성제 베니스 파리 감사 드리다 24 명의 관광객 이끌다 빡빡 일정 편안하다 자다 이끌다 좋다 전혀 기대하다 가다 여행 전체 여행 리드 해주다 신상진 인솔 전체 일정 많다 해주다 조르다 성제 잊다 위트 빵빵 터지다 입담 모든 관광객 배꼽 잡다 만들다 덕분 여행사 서유럽 패키지 강력 추천 유럽 만나다 뵈다 저축 감사하다
서유럽,서유럽 여행 정은주 길라잡이 즐겁다 여행 가보다 유럽 처음 친형 다름없다 의형제 형님 유럽 자주 가보다 개국 투어 좋다 패키지 가다 개국 돌아보다 좋다 적극 이탈리아 스위스 프랑스 개국 투어 되어다 가보다 서다 되어다 우리나라 관광지 가다 힘드다 크다 가지 개국 바삐 돌아다니다 하니 여유 별로 비몽 투어 투어 느끼다 감정 표현 인간 예술 성과 천재 지구 대자연 끝판 오다 좋다 여행 형님 좋다 정은주 길라잡이 수고 해주다 본인 지치다 피곤하다 분위기 쇄신 투어 해주다 친누나 세심 배려 덕분 여행 편안함 문화 아들 가다 여행 전체 식구 정은주 길라잡이 형님 감사하다 남다 여행 기분 좋다 정리 일상 돌아가다 수가 흐뭇다 여행 가보다 처음 남기다 후기 비밀 기회 닿다 만나다 뵈다 건강하다
